title,link,word_count,date,author,comments_count,notes
Is Marriage Toxic to the Mental Health of Women?,http://lovein90days.com/dating-advice-for-women-is-marriage-toxic-to-mental-health/,685,"April 14, 2010",Dr. Diana Kirschner,0,
Dating Advice for Women-Mother's Day Tips for Moms & Adult Children,http://lovein90days.com/dating-advice-for-women-mothers-day-tips-for-moms-adult-children/,637,"April 21, 2010",Dr. Diana Kirschner,1,
Best Five Tips for Coping with a Breakup,http://lovein90days.com/five-tips-for-coping-with-a-breakup/,668,"June 4, 2010",Dr. Diana Kirschner,2,
Is Marriage Good For Women?,http://lovein90days.com/is-marriage-good-for-women/,741,"April 13, 2010",Dr. Diana Kirschner,0,
Ending Loneliness,http://lovein90days.com/ending-loneliness/,1304,"May 4, 2010",Dr. Diana Kirschner,1,
Five Secrets to Finding True Love: The Dating Program of Three,http://lovein90days.com/five-secrets-to-finding-true-love-the-dating-program-of-three/,652,"May 4, 2010",Dr. Diana Kirschner,3,
Four Ways You Can Overcome Shyness,http://lovein90days.com/overcome-shyness/,576,"June 11, 2010",Dr. Diana Kirschner,22,
Eight Steps to Creating Love in Your Life,http://lovein90days.com/eight-steps-to-finding-true-lovethe-2009-dating-plan/,1201,"January 1, 2009",Dr. Diana Kirschner,2,
Texting Love Advice & Etiquette,http://lovein90days.com/all-about-texting-dr-dianas-love-advice-relationship-etiquette/,345,"August 21, 2008",Dr. Diana Kirschner,3,
Look in The Mirror and Feel Better!,http://lovein90days.com/dating-advice-your-mirror-can-actually-help-you-feel-good-about-your-body/,374,"September 10, 2008",Dr. Diana Kirschner,2,
"A Love Ritual From My Guest Blogger, Barbara Biziou",http://lovein90days.com/a-love-ritual-from-my-guest-blogger-barbara-biziou/,774,"June 8, 2009",Dr. Diana Kirschner,0,
Four Keys to Creating Lasting Love,http://lovein90days.com/four-keys-to-creating-true-love/,1584,"November 4, 2009",Dr. Diana Kirschner,1,
Five Relationship Tips to Cope with the Holidays,http://lovein90days.com/dating-advice-five-ways-to-cope-with-the-holidays/,605,"November 4, 2009",Dr. Diana Kirschner,2,
Love in 90 Days #1 Dating Book on Amazon,http://lovein90days.com/love-in-90-days-1-dating-book-on-amazon/,255,"January 30, 2009",Dr. Diana Kirschner,3,
Beware of Frenemies,http://lovein90days.com/beware-of-frenemies/,699,"November 4, 2009",Dr. Diana Kirschner,0,
Relationship Advice: Too Much Support Harms Marital Satisfaction!,http://lovein90days.com/relationship-advice-warning-too-much-support-can-harm-your-marriage/,305,"November 30, 2009",Dr. Diana Kirschner,3,
Dating Patterns of The Sex and The City Women,http://lovein90days.com/four-sex-the-city-dating-patterns/,630,"November 4, 2009",Dr. Diana Kirschner,1,
Has Your Love Life Tanked?,http://lovein90days.com/is-your-love-life-tanked/,696,"August 15, 2008",Dr. Diana Kirschner,0,
