title,link,word_count,date,author,comments_count,notes
Dating Tips for Smart Successful Women: Key Relationship Secrets that Create Love that is Just Right for You!,http://lovein90days.com/getting-your-needs-met/,1387,"November 22, 2017",Dr. Diana Kirschner,0,
How to Date When You Want Kids Now,http://lovein90days.com/how-to-date-when-you-want-kids-now/,732,"August 7, 2017",Dr. Diana Kirschner,0,
What to Do When You Just Want to Say the F Word to Dating!,http://lovein90days.com/just-want-say-f-word-dating/,702,"August 28, 2017",Dr. Diana Kirschner,2,
Do You Feel Like There's Something Wrong with You?,http://lovein90days.com/feel-like-theres-something-wrong-with-you/,1337,"February 6, 2018",Dr. Diana Kirschner,0,
7 Keys for Moving on After Divorce or a Break Up,http://lovein90days.com/7-keys-moving-divorce-break-up/,763,"October 3, 2017",Dr. Diana Kirschner,1,
Are Limiting Beliefs Preventing You From Finding Love?,http://lovein90days.com/limiting-beliefs-thriving-launch-podcast/,287,"September 5, 2017",Dr. Diana Kirschner,1,
"When you realize THIS, you'll get over The One Who Got Away",http://lovein90days.com/the-one-who-got-away/,746,"October 24, 2017",Dr. Diana Kirschner,0,
Is Fighting Ruining Your Relationship? Here's How to Go From Breaking Up to Making Up,http://lovein90days.com/is-fighting-ruining-your-relationship/,797,"July 11, 2017",Dr. Diana Kirschner,0,
What Makes Men Fall in Love - The Most Important Factor!,http://lovein90days.com/makes-men-fall-love-important-factor/,503,"February 6, 2018",Dr. Diana Kirschner,0,
"Dating Dilemmas of Smart, Successful Women: What to Do When He Won't Commit",http://lovein90days.com/what-to-do-when-he-wont-commit/,978,"June 30, 2017",Dr. Diana Kirschner,0,
Dating Dilemmas of Successful Women: When Should You Become Exclusive with a Guy?,http://lovein90days.com/exclusive-dating/,619,"March 1, 2017",Dr. Diana Kirschner,0,
Dating Dilemmas of Successful Women: How to Speak Your Truth so He'll Actually Listen,http://lovein90days.com/dating-dilemmas-successful-women-speak-truth-he-will-listen/,715,"March 27, 2017",Dr. Diana Kirschner,0,
How to Survive the Holidays: Family Relationship Advice,http://lovein90days.com/holidays-family-relationship-advice/,709,"December 23, 2016",Dr. Diana Kirschner,0,
Avoid Divorce: 6 Things I Wish Couples Knew Before Getting Married,http://lovein90days.com/avoid-divorce/,940,"April 17, 2017",Dr. Diana Kirschner,0,
"Dating Dilemmas of Smart, Successful Women: Overcoming Abandonment Fears",http://lovein90days.com/dating-dilemmas-smart-successful-women-overcoming-abandonment-fears/,683,"May 12, 2017",Dr. Diana Kirschner,0,
"Dating Dilemmas of Smart, Successful Women: 5 Crucial Keys for Overcoming Rejection",http://lovein90days.com/overcoming-rejection/,842,"June 7, 2017",Dr. Diana Kirschner,0,
"Dating Dilemmas of Smart, Successful Women: How to Tell if He Has the Potential to Commit",http://lovein90days.com/will-he-commit/,825,"June 19, 2017",Dr. Diana Kirschner,0,
Dating Dilemmas of Successful Women: The #1 Dating Mistake Singles Make,http://lovein90days.com/number-one-dating-mistake-singles-make/,468,"February 13, 2017",Dr. Diana Kirschner,2,
When Your Friends or Family Undermine Your Love Life,http://lovein90days.com/friends-family-undermine-love-life/,884,"September 11, 2016",Dr. Diana Kirschner,0,
Dating Dilemmas of Smart Successful Women: 12 Key Flirting Moves To Amp Up Attraction,http://lovein90days.com/flirting-moves-to-amp-up-attraction/,366,"March 13, 2017",Dr. Diana Kirschner,0,
What To Do if He Keeps Texting But Doesn't Ask You Out,http://lovein90days.com/he-keeps-texting-doesnt-ask-me-out/,529,"September 23, 2016",Dr. Diana Kirschner,0,
How to Tell if a Guy has True Soulmate Potential,http://lovein90days.com/how-to-tell-if-a-guy-has-soulmate-potential/,475,"October 13, 2016",Dr. Diana Kirschner,0,
Not Willing to Settle in Your Love Life?  Here's a Crucial Bit of Relationship Coaching Just for You,http://lovein90days.com/not-willing-settle-love-life/,635,"August 25, 2016",Dr. Diana Kirschner,1,
Dating Dilemmas of Successful Women: Eight Steps to Find True Love,http://lovein90days.com/find-lasting-love/,760,"February 13, 2017",Dr. Diana Kirschner,0,
Dating Dilemmas of Successful Women: Accessing Your Irresistible Feminine Power,http://lovein90days.com/successful-women-feminine-power/,668,"October 25, 2016",Dr. Diana Kirschner,0,
Dating Dilemmas of Successful Women: Does Your Success Scare Guys Away?,http://lovein90days.com/does-your-success-scare-guys/,527,"November 1, 2016",Dr. Diana Kirschner,0,
Dating Dilemmas of Successful Women: Should You Ask Him Out and Plan Dates?,http://lovein90days.com/dating-dilemmas-successful-women-should-you-ask-him-out/,422,"December 1, 2016",Dr. Diana Kirschner,2,
Smart Men Marry Smart Women -  Here's the Research,http://lovein90days.com/smart-men-marry-smart-women/,531,"July 5, 2016",Dr. Diana Kirschner,0,
How to Network to the Job and Man of Your Dreams,http://lovein90days.com/network-job-man-dreams/,825,"December 16, 2016",Dr. Diana Kirschner,0,
The Very Best Way to Meet a Successful Loving Man,http://lovein90days.com/meet-successful-loving-man/,760,"July 21, 2016",Dr. Diana Kirschner,0,
Six Relationship Tips to Spark Chemistry with a Good Man,http://lovein90days.com/six-tips-to-spark-chemistry-with-a-good-man/,1003,"March 1, 2016",Dr. Diana Kirschner,16,
How Do I Know If I've Found My Soulmate? 11 Signs.,http://lovein90days.com/soulmate-11-signs/,960,"March 1, 2016",Dr. Diana Kirschner,55,
Dating Confidence: How to Be Irresistible and Real with Men,http://lovein90days.com/dating-confidence-how-to-be-real-with-men/,377,"April 26, 2016",Dr. Diana Kirschner,2,
Does He Have Soulmate Potential?,http://lovein90days.com/does-he-have-soulmate-potential/,433,"May 6, 2016",Dr. Diana Kirschner,3,
8 Best Flirting Tips to Bring a Shy Guy Out of His Shell,http://lovein90days.com/flirting-tips-shy-guy/,845,"March 1, 2016",Dr. Diana Kirschner,61,
Five Red Flags That Predict Heartbreak is Ahead,http://lovein90days.com/five-red-flags-that-predict-heartbreak-is-ahead/,592,"March 1, 2016",Dr. Diana Kirschner,10,
Do Smart Successful Men Marry Down?,http://lovein90days.com/smart-successful-men-marry-down/,527,"June 21, 2016",Dr. Diana Kirschner,0,
Create Self-Confidence With This Simple Exercise!,http://lovein90days.com/create-self-confidence-chocolate-cake/,455,"March 22, 2014",Dr. Diana Kirschner,6,
Three Beliefs That Could Be Ruining Your Chances at Love,http://lovein90days.com/three-beliefs-ruining-chances-love/,831,"May 27, 2016",Dr. Diana Kirschner,0,
Discover the Hidden Beauty in Your Face,http://lovein90days.com/hidden-beauty/,510,"March 29, 2014",Dr. Diana Kirschner,5,
Handling A Non-Committal Guy,http://lovein90days.com/handle-non-committal-guy/,850,"March 1, 2016",Dr. Diana Kirschner,2,
"Is He the One? Here's How to Know, Part I",http://lovein90days.com/is-he-the-one/,653,"April 1, 2016",Dr. Diana Kirschner,4,
Service to Others vs. Co-Dependendency,http://lovein90days.com/service-to-others-vs-co-dependendency/,470,"July 1, 2014",Dr. Diana Kirschner,3,
How to Feel Self-Confident & Irresistibly Attractive,http://lovein90days.com/how-to-feel-self-confident-at-any-age/,623,"June 24, 2014",Dr. Diana Kirschner,0,
Wall Street Journal Celebrates The Future of Love,http://lovein90days.com/wall-street-journal-future-of-love/,422,"July 14, 2014",Dr. Diana Kirschner,2,
Four Ways to Turn Jealousy Around,http://lovein90days.com/four-ways-to-turn-jealousy-around/,942,"March 1, 2016",Dr. Diana Kirschner,2,
One Secret Can Make Your Dreams of Love Come True,http://lovein90days.com/one-secret-can-make-your-dreams-of-love-come-true/,433,"November 16, 2014",Dr. Diana Kirschner,10,
The Simplest Fix for an Unhappy Love Life,http://lovein90days.com/love-life/,674,"October 3, 2014",Dr. Diana Kirschner,8,
Breaking Up Quiz: 20 Questions to Ask Yourself Before You Do,http://lovein90days.com/breakup-quiz-20-questions-to-ask-yourself/,762,"March 1, 2016",Dr. Diana Kirschner,5,
Single at Holiday Time? Five Ways to Cope,http://lovein90days.com/single-at-holiday-time-five-ways-to-cope/,657,"November 26, 2013",Dr. Diana Kirschner,2,
Dating Games Men Play,http://lovein90days.com/dating-games-men-play/,851,"March 1, 2016",Dr. Diana Kirschner,10,
Are Men Really After One Thing? Part 1,http://lovein90days.com/men-one-thing-part-1/,556,"December 5, 2013",Dr. Diana Kirschner,1,
What Are Men Really After? Part 2,http://lovein90days.com/sex-men-really-one-thing-part-2/,588,"December 11, 2013",Dr. Diana Kirschner,1,
Living Together Before Marriage: Part 2,http://lovein90days.com/living-together-before-marriage/,686,"November 18, 2013",Dr. Diana Kirschner,1,
Appreciation: The Key to Happiness,http://lovein90days.com/living-appreciation/,650,"January 26, 2014",Dr. Diana Kirschner,0,
Long Distance Relationships: Should I Move 3000 Miles?,http://lovein90days.com/long-distance-relationships/,545,"December 24, 2013",Dr. Diana Kirschner,6,
Find Serenity By Not Overgiving,http://lovein90days.com/find-serenity/,688,"February 25, 2014",Dr. Diana Kirschner,3,
Say Hello to Inner Peace & Goodbye to Your Inner Critic,http://lovein90days.com/inner-peace/,882,"February 19, 2014",Dr. Diana Kirschner,3,
Boomer Dating Tips: Love For Women Over 40,http://lovein90days.com/boomer-dating/,719,"January 12, 2014",Dr. Diana Kirschner,0,
How to Calm Your Troubled Mind,http://lovein90days.com/calm-troubled-mind/,787,"March 15, 2014",Dr. Diana Kirschner,1,
Getting Over Heartbreak: A True Love Story,http://lovein90days.com/getting-over-heartbreak-true-love-story/,615,"September 17, 2013",Dr. Diana Kirschner,1,
Three Relationship Tips to Banish The Body Blues,http://lovein90days.com/relationship-tips-body-blues/,576,"October 7, 2013",Dr. Diana Kirschner,2,
Online Dating Tips Video: Five Top Tips for Women,http://lovein90days.com/top-5-online-dating-tips-video/,281,"October 15, 2013",Dr. Diana Kirschner,0,
Non-Committal Man Quiz: Find Out if He's Committed,http://lovein90days.com/non-committal-man-quiz/,588,"September 20, 2013",Dr. Diana Kirschner,5,
Five Tips to Banish Feeling Fat,http://lovein90days.com/five-tips-to-banish-feeling-fat/,915,"October 21, 2013",Dr. Diana Kirschner,2,
How My Dating & Love Life Changed Through Dr. Diana's Love Mentoring,http://lovein90days.com/dating-love-life-changed-love-mentoring/,741,"October 23, 2013",Dr. Diana Kirschner,3,
Relationship Coach for Women Over 40,http://lovein90days.com/relationship-coach-for-women-over-40/,693,"November 2, 2013",Dr. Diana Kirschner,5,
Five Tips to Turn Love Disappointments into Triumphs,http://lovein90days.com/five-tips-to-turn-love-disappointments-into-triumphs/,816,"September 8, 2013",Dr. Diana Kirschner,0,
"Living Together Before Marriage: The Good, Bad and Ugly Part 1",http://lovein90days.com/living-together-part-1/,699,"November 16, 2013",Dr. Diana Kirschner,0,
Love At First Sight: Does It Exist?,http://lovein90days.com/love-at-first-sight/,590,"November 9, 2013",Dr. Diana Kirschner,14,
Benefits of Spiritual Practice in Healing Relationships: Part 2,http://lovein90days.com/benefits-of-a-spiritual-practice-in-healing-relationships-part-2/,517,"May 16, 2013",Dr. Diana Kirschner,2,
How do I get the sexy back with my partner?,http://lovein90days.com/how-do-i-get-the-sexy-back-with-my-partner/,798,"June 27, 2013",Dr. Diana Kirschner,0,
A Confession: How I Practice Relationship Sabotage,http://lovein90days.com/a-personal-confession-about-relationship-sabotage/,491,"June 13, 2013",Dr. Diana Kirschner,1,
Soulmate Talking: The Power of Speaking Your Truth,http://lovein90days.com/soulmate-talking/,706,"June 19, 2013",Dr. Diana Kirschner,0,
Top Ten Romantic Texts,http://lovein90days.com/top-ten-romantic-texts/,391,"July 19, 2013",Dr. Diana Kirschner,0,
How to Overcome Self-Doubt and Find Soulmate Love,http://lovein90days.com/how-to-overcome-self-doubt-and-find-soulmate-love/,587,"August 15, 2013",Dr. Diana Kirschner,0,
Taking Touch: The Secret to Sexual Ecstasy With Your Partner,http://lovein90days.com/taking-touch-the-secret-to-sexual-ecstasy-with-your-partner/,470,"July 6, 2013",Dr. Diana Kirschner,0,
How to End Relationship Frustrations,http://lovein90days.com/how-to-end-relationship-frustrations/,969,"August 10, 2013",Dr. Diana Kirschner,1,
Finding Self-Love (Without the Sugar),http://lovein90days.com/finding-self-love-without-the-sugar/,645,"August 31, 2013",Dr. Diana Kirschner,1,
"Finding Love After Loss (Weight-Loss, That Is!)",http://lovein90days.com/finding-love-after-loss-weight-loss-that-is/,659,"August 28, 2013",Dr. Diana Kirschner,0,
Passionate Relationship - 8 Secrets to Getting There,http://lovein90days.com/passionate-relationship/,514,"October 25, 2012",Dr. Diana Kirschner,0,
5 Best Holiday Gifts for Him,http://lovein90days.com/5-best-holiday-gifts-for-him/,456,"November 11, 2012",Dr. Diana Kirschner,0,
Is Marriage Toxic to Women?,http://lovein90days.com/is-marriage-toxic-to-women/,702,"October 20, 2012",Dr. Diana Kirschner,1,
"Heart Open, Wallet Shut: Avoiding Romance Scams in Online Dating",http://lovein90days.com/heart-open-wallet-shut-avoiding-romance-scams-in-online-dating/,544,"January 27, 2013",Dr. Diana Kirschner,1,
Find Your Soulmate Online in 6 Simple Steps,http://lovein90days.com/find-your-soulmate-online/,697,"January 23, 2013",Dr. Diana Kirschner,0,
Do You Know Your Self-Love Quotient?,http://lovein90days.com/your-self-love-quotient/,343,"December 10, 2012",Dr. Diana Kirschner,0,
Your First Date on DatingAdvice.com,http://lovein90days.com/dr-dianas-latest-dating-blog-on-datingadvice-com/,141,"February 22, 2013",Dr. Diana Kirschner,0,
Three common online dating mistakes,http://lovein90days.com/three-common-online-dating-mistakes/,416,"February 12, 2013",Dr. Diana Kirschner,0,
Happy Mother's Day,http://lovein90days.com/happy-mothers-day/,314,"May 12, 2013",Dr. Diana Kirschner,0,
The Power of Spiritual Practice in Healing Relationships: Part 1,http://lovein90days.com/the-power-of-spiritual-practice-in-healing-relationships-part-1/,620,"May 4, 2013",Dr. Diana Kirschner,0,
How I Healed Myself Through The Power of Intention,http://lovein90days.com/the-healing-power-of-intention/,728,"September 22, 2012",Dr. Diana Kirschner,0,
Should I Get Back With My Ex? 7 Signs to Help You Know,http://lovein90days.com/when-and-how-to-get-back-with-my-ex-7-signs-to-help-you-know/,547,"September 26, 2012",Dr. Diana Kirschner,4,
Finding Soulmate Love: Ancient Secrets Revealed,http://lovein90days.com/ancient-secrets-for-finding-soulmate-love/,633,"October 2, 2012",Dr. Diana Kirschner,0,
Why Are Some Men Emotionally Unavailable?,http://lovein90days.com/why-are-some-men-emotionally-unavailable/,868,"September 30, 2012",Dr. Diana Kirschner,2,
8 Flirting Tips That Say You're Interested,http://lovein90days.com/flirting/,943,"October 1, 2012",Dr. Diana Kirschner,1,
How to Find Your Soulmate,http://lovein90days.com/how-to-find-your-soulmate/,923,"October 11, 2012",Dr. Diana Kirschner,2,
The Biggest Lie about Age that Women Still Believe,http://lovein90days.com/the-biggest-lie-about-age-that-women-still-believe/,1012,"September 29, 2012",Dr. Diana Kirschner,1,
How to Have Hot Intimacy and Great Sex with Your Partner,http://lovein90days.com/how-to-have-hot-intimacy-great-sex-with-your-partner-read-listen-go-for-it/,711,"October 7, 2012",Dr. Diana Kirschner,0,
The Secret to Creating Self-Love,http://lovein90days.com/the-secret-to-creating-self-love/,865,"October 14, 2012",Dr. Diana Kirschner,0,
Five Relationship Tips for Talking About a Touchy Subject,http://lovein90days.com/five-relationship-tips-for-talking-about-a-touchy-subject/,736,"October 18, 2012",Dr. Diana Kirschner,0,
How Samantha Used One Simple Idea To Create Sacred Longterm Love,http://lovein90days.com/how-samantha-used-one-simple-idea-to-create-sacred-lasting-love/,1242,"May 11, 2012",Dr. Diana Kirschner,0,
How Darlene Got Over Her Ex,http://lovein90days.com/how-darlene-got-over-her-ex/,414,"June 28, 2012",Dr. Diana Kirschner,4,
Sex and Lovemaking Secrets Of 50 Shades of Grey Revealed,http://lovein90days.com/lovemaking-secrets-of-50-shades-of-grey-revealed/,661,"June 15, 2012",Dr. Diana Kirschner,0,
"Four Best Sex Secrets - The Love Mentor's Guide, Part 1",http://lovein90days.com/best-sex-secrets/,1008,"September 3, 2012",Dr. Diana Kirschner,0,
Six Dating Tips for Baby Boomer Dating Success,http://lovein90days.com/baby-boomer-dating-tips/,1149,"September 4, 2012",Dr. Diana Kirschner,6,
Four Best Sex Secrets - The Love Mentor's Guide Part 2,http://lovein90days.com/sex-secrets/,883,"September 8, 2012",Dr. Diana Kirschner,0,
Irresistible Flirting Tips Video,http://lovein90days.com/flirting-tips-video/,488,"August 2, 2012",Dr. Diana Kirschner,0,
Secrets of Online Dating Success For Over 40s: Part 1,http://lovein90days.com/secrets-of-online-dating-success-part-1/,1233,"September 20, 2012",Dr. Diana Kirschner,3,
"How I Met and Fell For ""Vampire Bill"" from True Blood",http://lovein90days.com/dating-stories-from-the-front-vampire-bill-from-true-blood/,1373,"September 22, 2012",Dr. Diana Kirschner,0,
Ten Signs That You've Met the One,http://lovein90days.com/ten-signs-that-youve-met-the-one/,627,"January 26, 2012",Dr. Diana Kirschner,0,
Turn a Tense Frustrating Relationship into a Super Happy One in 3 Simple Steps,http://lovein90days.com/turn-a-tense-rocky-relationship-into-a-super-happy-one-in-3-simple-steps/,1095,"January 10, 2012",Dr. Diana Kirschner,5,
A Simple Change that Led to a GREAT Romance,http://lovein90days.com/a-simple-change-that-led-to-a-great-romance/,593,"January 23, 2012",Dr. Diana Kirschner,1,
Finding Your Diamond Self: Confident and Empowered!,http://lovein90days.com/finding-your-diamond-self-confident-empowered/,1472,"February 16, 2012",Dr. Diana Kirschner,0,
Secrets of Online Dating Success For Over 40s: Part 2,http://lovein90days.com/secrets-of-online-dating-success-for-over-40s-part-2/,1238,"September 21, 2012",Dr. Diana Kirschner,2,
Top Secrets for Passionate Lasting Love! Episode Two,http://lovein90days.com/top-secrets-for-lasting-love-episode-two/,234,"February 15, 2012",Dr. Diana Kirschner,0,
Top Secrets of Passionate Lasting Love-New Web Series!,http://lovein90days.com/top-secrets-of-passionate-lasting-love-web-series/,265,"February 7, 2012",Dr. Diana Kirschner,0,
How A Diamond Self Identity Led to Romance,http://lovein90days.com/how-a-diamond-self-identity-lead-to-an-awesome-romance/,858,"February 29, 2012",Dr. Diana Kirschner,0,
Transforming Heartbreak To Happiness,http://lovein90days.com/transforming-heartbreak-to-happiness/,1685,"March 14, 2012",Dr. Diana Kirschner,0,
The Fine Art of Seduction: Four Secrets You Must Know,http://lovein90days.com/the-fine-art-of-seduction-four-secrets-you-must-know/,1124,"April 13, 2012",Dr. Diana Kirschner,0,
How Limiting Beliefs Hurt Alicia's Dreams of Love,http://lovein90days.com/how-limiting-beliefs-hurt-alicias-dreams/,597,"May 6, 2012",Dr. Diana Kirschner,0,
Seven Best Relationship Tips for Rekindling Passion,http://lovein90days.com/seven-best-relationship-tips-for-rekindling-passion/,451,"January 27, 2011",Dr. Diana Kirschner,4,
Create Passionate Lasting Love in 2011,http://lovein90days.com/create-passionate-lasting-love-in-2011with-tons-of-gifts-too/,351,"February 13, 2011",Dr. Diana Kirschner,2,
What is A Love Mentor ®? FAQ,http://lovein90days.com/what-is-love-mentoring-faq/,897,"June 10, 2011",Dr. Diana Kirschner,2,
Hilarious Dating Story!!,http://lovein90days.com/hilarious-dating-advice-story/,1259,"May 5, 2011",Dr. Diana Kirschner,3,
The Power of Spiritual Practice When Life Becomes Overwhelming,http://lovein90days.com/spiritual-practice-when-life-becomes-overwhelming/,1067,"April 24, 2011",Dr. Diana Kirschner,3,
Journaling Your Way to Love: Dating Advice For Women,http://lovein90days.com/dating-advice-for-women-journaling-to-great-love/,919,"August 27, 2011",Dr. Diana Kirschner,2,
Relationship Advice: How Bad Communication is Like Bad Plumbing,http://lovein90days.com/relationship-advice-how-bad-communication-is-like-bad-plumbing/,642,"September 5, 2011",Dr. Diana Kirschner,2,
How to be Happy for No Reason (and Get the Love You Want Too)!,http://lovein90days.com/how-to-be-happy-for-no-reason-and-get-the-love-you-want-too/,882,"October 1, 2011",Dr. Diana Kirschner,4,
Finding Love After 50 - Dating Advice for Women Over 50,http://lovein90days.com/finding-love-after-50-without-being-turned-off-or-burnt-out/,983,"November 15, 2011",Dr. Diana Kirschner,5,
Dating Advice for Women Over 50: How To Be Irresistibly Attractive,http://lovein90days.com/how-to-be-irresistibly-attractive-without-being-thinner-or-younger/,1475,"December 15, 2011",Dr. Diana Kirschner,4,
Five Relationship Tips That Save a Rich Partner Poor Partner Couple,http://lovein90days.com/five-love-tips-that-can-save-a-rich-partner-poor-partner-relationship/,570,"November 4, 2010",Dr. Diana Kirschner,1,
Top Seven Urban Love Legends,http://lovein90days.com/seven-urban-love-legends/,586,"November 5, 2010",Dr. Diana Kirschner,8,
Three Relationship Tips About Commitment,http://lovein90days.com/kate-middleton-gets-her-prince-three-lessons-about-commitment/,573,"December 21, 2010",Dr. Diana Kirschner,2,
The New Cougars,http://lovein90days.com/dating-survey-reveals-the-new-cougars/,289,"November 11, 2010",Dr. Diana Kirschner,3,
Top 5 Romantic Winter Dates,http://lovein90days.com/top-5-romantic-winter-dates/,489,"November 4, 2010",Dr. Diana Kirschner,2,
Shy on a First Date?  Seven Tips to Make You Sparkle,http://lovein90days.com/shy-on-a-first-date-seven-tips-to-make-you-sparkle/,406,"December 6, 2010",Dr. Diana Kirschner,2,
Online Dating for the Over 40s,http://lovein90days.com/online-dating-for-the-over-40s/,643,"November 15, 2010",Dr. Diana Kirschner,3,
Kate Middleton's Four Relationship Tips for Marrying a Prince,http://lovein90days.com/kate-middletons-four-secrets-for-marrying-a-prince/,843,"December 11, 2010",Dr. Diana Kirschner,0,
Nine Ways to Help You Believe in Yourself,http://lovein90days.com/nine-ways-to-help-you-believe-in-yourself/,1049,"January 7, 2011",Dr. Diana Kirschner,0,
Lasting Love: How to Have an Affair with Your Partner,http://lovein90days.com/how-to-have-an-ongoing-affair-with-your-partner/,786,"December 24, 2010",Dr. Diana Kirschner,1,
Age Of Abundant Love Through Online Dating-on the Today Show!,http://lovein90days.com/welcome-to-the-age-of-abundant-love/,541,"September 29, 2010",Dr. Diana Kirschner,5,
Is He Interested? New Study Tells You,http://lovein90days.com/is-he-interested/,311,"November 1, 2010",Dr. Diana Kirschner,2,
Do You Have Dating Anxiety?,http://lovein90days.com/do-you-have-dating-dawdlitis/,906,"October 15, 2010",Dr. Diana Kirschner,1,
How to Fight Fairly with Your Partner (So You Both Win),http://lovein90days.com/how-to-fight-fairly-with-your-partner-so-you-both-win/,809,"October 31, 2010",Dr. Diana Kirschner,1,
How to Find the One: Part 2,http://lovein90days.com/how-to-find-the-one-part-2/,674,"November 1, 2010",Dr. Diana Kirschner,1,
Harness the Power of Positive Self-Affirmations,http://lovein90days.com/harness-the-power-of-positive-self-affirmations/,1179,"November 1, 2010",Dr. Diana Kirschner,0,
How to Find the One: Part 1,http://lovein90days.com/how-to-find-the-one-part-1/,1048,"November 1, 2010",Dr. Diana Kirschner,0,
The Fight Club Rules with Your Partner,http://lovein90days.com/the-fight-club-rules-how-to-fight-with-your-partner/,804,"October 1, 2010",Dr. Diana Kirschner,2,
Four Key Dating Tips for Single Mothers,http://lovein90days.com/four-key-dating-tips-for-single-mothers/,485,"November 2, 2010",Dr. Diana Kirschner,4,
Dating Secrets for Summer,http://lovein90days.com/beauty-dating-secrets-for-summer/,361,"June 17, 2010",Dr. Diana Kirschner,0,
Best Online Dating Websites,http://lovein90days.com/search-the-best-online-dating-websites/,1474,"June 14, 2010",Dr. Diana Kirschner,8,
"Once a Cheater, Always a Cheater? Five Signs to Know",http://lovein90days.com/once-a-cheater-always-a-cheater/,669,"November 1, 2010",Dr. Diana Kirschner,3,
How to Create Committed Lasting Love,http://lovein90days.com/how-to-create-committed-lasting-love/,758,"July 26, 2010",Dr. Diana Kirschner,0,
The Five Secrets of Getting Lucky In Love,http://lovein90days.com/the-five-secrets-of-getting-lucky-in-love/,857,"July 4, 2010",Dr. Diana Kirschner,3,
Love Mentoring Leads to Marriage in The NY Times,http://lovein90days.com/love-mentoring-leads-to-happiest-ever-ending-in-todays-ny-times/,544,"August 8, 2010",Dr. Diana Kirschner,0,
How to Go from Casual to Committed Love,http://lovein90days.com/the-single-most-important-thing-you-can-do-to-win-the-committed-lasting-love-of-the-one-you-really-want/,743,"August 31, 2010",Dr. Diana Kirschner,1,
Marrying Kind of Men: Seven Key Signs,http://lovein90days.com/the-marrying-kind-of-men-seven-key-signs-2/,614,"July 27, 2010",Dr. Diana Kirschner,3,
Dating Advice for Women Over 50: Part 1,http://lovein90days.com/dating-advice-for-women-over-50-part-1/,1055,"September 5, 2010",Dr. Diana Kirschner,1,
Dating Advice for Women Over 50: Part 2,http://lovein90days.com/dating-advice-for-women-45-and-over-part-2/,1131,"September 5, 2010",Dr. Diana Kirschner,0,
Hooking Up & Other Dating Difficulties,http://lovein90days.com/hooking-up-other-dating-difficulties/,360,"September 15, 2010",Dr. Diana Kirschner,1,
My Date Him or Dump Him Quiz on The Today Show,http://lovein90days.com/my-date-him-or-dump-him-quiz-on-the-today-show/,368,"February 19, 2010",Dr. Diana Kirschner,3,
Dating and Mating Advice: It's Better to Wait to Have Sex,http://lovein90days.com/dating-mating-advice-its-better-to-wait-to-have-sex/,539,"January 6, 2010",Dr. Diana Kirschner,1,
Why Men Fear Commitment,http://lovein90days.com/dating-advice-for-women-why-men-fear-commitment/,361,"December 27, 2009",Dr. Diana Kirschner,6,
