title,link,word_count,date,author,comments_count,notes
Before and after: A $6 ceiling fan makeover,https://www.getrichslowly.org/before-and-after-a-6-ceiling-fan-makeover/,1142,11 Feb 14,April Dykman,51,
Ask the Readers: What do you do when someone constantly hits you up for money?,https://www.getrichslowly.org/ask-the-readers-what-do-you-do-when-someone-constantly-hits-you-up-for-money/,623,07 Feb 14,April Dykman,126,
"Phishing, vishing, and SMShing",https://www.getrichslowly.org/phishing-vishing-and-smshing/,1259,12 Feb 14,Holly Johnson,28,
Pick your hobbies strategically and save,https://www.getrichslowly.org/pick-your-hobbies-strategically-and-save/,1074,17 Feb 14,Honey Smith,73,
Do we have a duty to live up to our potential?,https://www.getrichslowly.org/do-we-have-a-duty-to-live-up-to-our-potential/,1157,13 Feb 14,Financial Samurai,85,
Maximizing your dollar: Renovating a historic house for the rental market,https://www.getrichslowly.org/maximizing-your-dollar-renovating-a-historic-house-for-the-rental-market/,1361,23 Feb 14,Get Rich Slowly Editors,6,
"A case for ""hard work pays off""",https://www.getrichslowly.org/a-case-for-hard-work-pays-off/,1173,19 Feb 14,Kristin Wong,42,
How to Handle a Windfall,https://www.getrichslowly.org/how-to-handle-a-windfall/,1116,20 Feb 14,J.D. Roth,29,
Don't have savings? Quit making excuses,https://www.getrichslowly.org/dont-have-savings-quit-making-excuses/,1493,25 Feb 14,Donna Freedman,81,
Too much emergency fund? Spend it!,https://www.getrichslowly.org/too-much-emergency-fund/,1525,26 Feb 14,Holly Johnson,79,
Investing Ideas that Avoid the Stock Market,https://www.getrichslowly.org/8-investing-ideas-that-avoid-the-stock-market/,1462,27 Feb 14,Jeff Rose,37,
How to spring clean your financial house,https://www.getrichslowly.org/how-to-spring-clean-your-financial-house/,1231,28 Feb 14,April Dykman,33,
"Why home prices are climbing again, and what you should do about it",https://www.getrichslowly.org/why-home-prices-are-climbing-again-and-what-you-should-do-about-it/,1194,04 Mar 14,William Cowie,32,
Finding the road out of poverty,https://www.getrichslowly.org/finding-the-road-out-of-poverty/,1135,24 Feb 14,Lisa Aberle,149,
5 car maintenance services you can get for free,https://www.getrichslowly.org/5-car-maintenance-services-you-can-get-for-free/,889,05 Mar 14,Kristin Wong,33,
Financing your bucket list,https://www.getrichslowly.org/financing-your-bucket-list/,1237,07 Mar 14,Ellen Cannon,39,
The joy of being average,https://www.getrichslowly.org/the-joy-of-being-average/,1926,13 Mar 14,Financial Samurai,94,
"Charity, hobby, or mistake? The cat we didn't keep",https://www.getrichslowly.org/charity-hobby-or-mistake-the-cat-we-didnt-keep/,1124,17 Mar 14,Honey Smith,62,
How to get started investing,https://www.getrichslowly.org/how-to-get-started-investing/,1619,18 Mar 14,William Cowie,33,
Why paying with cash hurts (and why it should),https://www.getrichslowly.org/why-paying-with-cash-hurts-and-why-it-should/,1262,12 Mar 14,Holly Johnson,58,
Professional investment advice (and why you should ignore it),https://www.getrichslowly.org/professional-investment-advice-and-why-you-should-ignore-it/,1954,20 Mar 14,J.D. Roth,77,
"Overwork and the illusion of a ""high-paying"" job",https://www.getrichslowly.org/overwork-and-the-illusion-of-a-high-paying-job/,1631,19 Mar 14,Kristin Wong,68,
"No, credit cards are not evil",https://www.getrichslowly.org/no-credit-cards-are-not-evil/,1160,26 Mar 14,Holly Johnson,87,
Why we aren't saving for our children's college educations,https://www.getrichslowly.org/why-we-arent-saving-for-our-childrens-college-educations/,1129,24 Mar 14,Lisa Aberle,144,
Ask the Readers: How many wedding gifts should you buy?,https://www.getrichslowly.org/ask-the-readers-how-many-wedding-gifts-should-you-buy/,760,28 Mar 14,April Dykman,86,
Which online high yield saving account and money market account is best?,https://www.getrichslowly.org/which-online-high-yield-savings-account-is-best/,1157,02 Apr 14,J.D. Roth,33,
What's the value of work-life balance?,https://www.getrichslowly.org/whats-the-value-of-work-life-balance/,1105,31 Mar 14,Honey Smith,54,
The cultural shift toward financial security,https://www.getrichslowly.org/the-cultural-shift-toward-financial-security/,1125,02 Apr 14,Kristin Wong,27,
What Are Dividend Reinvestment Plans?,https://www.getrichslowly.org/how-you-too-can-drip-with-cash/,1240,27 Mar 14,William Cowie,29,
Spending less than you earn so the Joneses don't keep up with you,https://www.getrichslowly.org/spending-less-than-you-earn-so-the-joneses-dont-keep-up-with-you/,1048,07 Apr 14,Lisa Aberle,69,
Cultivate your X-factor before it's too late,https://www.getrichslowly.org/cultivate-your-x-factor-before-its-too-late/,1593,08 Apr 14,Financial Samurai,26,
The cure for vacation deprivation: A vacation budget,https://www.getrichslowly.org/the-cure-for-vacation-deprivation-a-vacation-budget/,1024,09 Apr 14,Holly Johnson,51,
Reader Stories: The Notebook (Part 2),https://www.getrichslowly.org/reader-stories-the-notebook-part-2/,2596,06 Apr 14,Get Rich Slowly Editors,23,
The power of profit margin,https://www.getrichslowly.org/the-power-of-profit-margin/,1421,10 Apr 14,J.D. Roth,40,
Another visit with the real Millionaire Next Door,https://www.getrichslowly.org/another-visit-with-the-real-millionaire-next-door/,1639,13 Apr 14,J.D. Roth,16,
Foreclosure from the tenant's perspective: Honey's story,https://www.getrichslowly.org/foreclosure-from-the-tenants-perspective-honeys-story/,1118,14 Apr 14,Honey Smith,32,
8 years of Get Rich Slowly,https://www.getrichslowly.org/8-years-of-get-rich-slowly/,4727,15 Apr 14,J.D. Roth,21,
"Giving makes us happier, but what if you don't have much to give?",https://www.getrichslowly.org/giving-makes-us-happier-but-what-if-you-dont-have-much-to-give/,973,16 Apr 14,Kristin Wong,39,
My year-long quest to create a guide to mastering money,https://www.getrichslowly.org/my-year-long-quest-to-create-a-guide-to-mastering-money/,1570,17 Apr 14,J.D. Roth,25,
Best CD Rates | Certificate of Deposit Rates,https://www.getrichslowly.org/best-cd-rates-certificate-of-deposit-rates/,1460,18 Apr 14,Get Rich Slowly Editors,34,
Talking with Gretchen Rubin about money and happiness,https://www.getrichslowly.org/gretchen-rubin-money-and-happiness/,2732,20 Apr 14,J.D. Roth,23,
Cutting grocery bills: Aldi and bulk-food stores,https://www.getrichslowly.org/cutting-grocery-bills-aldi-and-bulk-food-stores/,915,21 Apr 14,Lisa Aberle,70,
More on how to stop buying clothes you never wear,https://www.getrichslowly.org/more-on-how-to-stop-buying-clothes-you-never-wear-2/,1687,22 Apr 14,April Dykman,50,
Get Rich Slowly: The Course,https://www.getrichslowly.org/get-rich-slowly-the-course/,578,23 Apr 14,J.D. Roth,27,
Ask the Readers: What's your embarrassing money moment?,https://www.getrichslowly.org/ask-the-readers-whats-your-embarrassing-money-moment/,692,25 Apr 14,April Dykman,49,
How to track your spending (and why you should),https://www.getrichslowly.org/how-to-track-your-spending-and-why-you-should/,1192,24 Apr 14,Holly Johnson,82,
"Book review: ""Eventual Millionaire""",https://www.getrichslowly.org/book-review-eventual-millionaire/,1156,28 Apr 14,Honey Smith,15,
The new way to get rich slowly,https://www.getrichslowly.org/the-new-way-to-get-rich-slowly/,1405,29 Apr 14,William Cowie,84,
"Money challenges: Why I'm OK with them, and a few of my favorites",https://www.getrichslowly.org/money-challenges-why-im-ok-with-them-and-a-few-of-my-favorites/,1262,30 Apr 14,Kristin Wong,52,
Ask the Readers: Do you stress-test your finances?,https://www.getrichslowly.org/ask-the-readers-do-you-stress-test-your-finances/,491,02 May 14,Get Rich Slowly Editors,23,
'When She Makes More': 10 rules for breadwinning women,https://www.getrichslowly.org/10-rules-for-breadwinning-women/,1453,01 May 14,J.D. Roth,144,
A conversation with Mr. Money Mustache,https://www.getrichslowly.org/a-conversation-with-mr-money-mustache/,2639,04 May 14,J.D. Roth,30,
Eating healthy on a slim budget,https://www.getrichslowly.org/eating-healthy-on-a-slim-budget/,1202,06 May 14,April Dykman,72,
Coming to terms: retirement vs. financial independence,https://www.getrichslowly.org/coming-to-terms-retirement-vs-financial-independence/,1336,08 May 14,J.D. Roth,58,
One year later: The benefits and tragedies of self-employment,https://www.getrichslowly.org/one-year-later-the-benefits-and-tragedies-of-self-employment/,1348,07 May 14,Holly Johnson,79,
What type of procrastinator are you?,https://www.getrichslowly.org/what-type-of-procrastinator-are-you/,1096,12 May 14,Honey Smith,20,
Is this where you can cut the most the quickest?,https://www.getrichslowly.org/is-this-where-you-can-cut-the-most-the-quickest/,1156,13 May 14,William Cowie,94,
The only two things you need to remember about funeral costs,https://www.getrichslowly.org/the-only-two-things-you-need-to-remember-about-funeral-costs/,1094,20 May 14,April Dykman,32,
The pursuit of passive income: Is it time to become a landlord?,https://www.getrichslowly.org/the-pursuit-of-passive-income-is-it-time-to-become-a-landlord/,1273,21 May 14,Holly Johnson,63,
Deals on wheels: Should you buy your child a car?,https://www.getrichslowly.org/deals-on-wheels-should-you-buy-your-child-a-car/,980,19 May 14,Lisa Aberle,98,
Honey progress report: Big change edition,https://www.getrichslowly.org/honey-progress-report-big-change-edition/,1091,26 May 14,Honey Smith,21,
Taking the Chairman's Flight and other career-limiting moves to avoid,https://www.getrichslowly.org/taking-the-chairmans-flight-and-other-career-limiting-moves-to-avoid/,1250,22 May 14,Financial Samurai,114,
A Guide to Managing Your Fear of Money,https://www.getrichslowly.org/a-guide-to-managing-your-fear-of-money/,1806,28 May 14,Kristin Wong,27,
Your landline: Think twice before cutting the cord,https://www.getrichslowly.org/your-landline-think-twice-before-cutting-the-cord/,1678,27 May 14,William Cowie,142,
In defense of frugality,https://www.getrichslowly.org/in-defense-of-frugality/,1239,29 May 14,Kristin Wong,52,
Teaching life skills to your children,https://www.getrichslowly.org/teaching-life-skills-to-your-children/,1223,02 Jun 14,Lisa Aberle,22,
Act surprised: Your wedding ring is a terrible investment,https://www.getrichslowly.org/act-surprised-your-wedding-ring-is-a-terrible-investment/,1746,04 Jun 14,Holly Johnson,101,
8 Surprise expenses for new homeowners,https://www.getrichslowly.org/8-surprise-expenses-for-new-homeowners/,1091,03 Jun 14,April Dykman,84,
One expense you have control of in ways you never thought,https://www.getrichslowly.org/one-expense-you-have-control-of-in-ways-you-never-thought/,1383,10 Jun 14,William Cowie,38,
Student loan update: Interest rate edition,https://www.getrichslowly.org/student-loan-update-interest-rate-edition/,1084,09 Jun 14,Honey Smith,62,
Becoming friends with your future self,https://www.getrichslowly.org/becoming-friends-with-your-future-self/,1115,11 Jun 14,Kristin Wong,25,
How to negotiate when you hate negotiating,https://www.getrichslowly.org/how-to-negotiate-when-you-hate-negotiating/,1476,12 Jun 14,Kristin Wong,19,
Ask the Readers: What Do You Do When You're Broke?,https://www.getrichslowly.org/ask-the-readers-what-do-you-do-when-youre-broke/,1200,06 Jun 14,J.D. Roth,147,
Homeowners: Could this save you thousands in just a few hours?,https://www.getrichslowly.org/homeowners-could-this-save-you-thousands-in-just-a-few-hours/,1248,17 Jun 14,April Dykman,33,
Ask the Readers: Are the Ã¢â‚¬Å“golden handcuffsÃ¢â‚¬Â real or self-imposed?,https://www.getrichslowly.org/ask-the-readers-are-the-golden-handcuffs-real-or-self-imposed/,678,13 Jun 14,Get Rich Slowly Editors,44,
The high cost of keeping up with the Joneses,https://www.getrichslowly.org/the-high-cost-of-keeping-up-with-the-joneses/,1325,18 Jun 14,Holly Johnson,69,
Improve your negotiation skills with BATNA,https://www.getrichslowly.org/improve-your-negotiation-skills-with-batna/,1497,19 Jun 14,Financial Samurai,21,
Motivation and money,https://www.getrichslowly.org/motivation-and-money/,1101,23 Jun 14,Honey Smith,34,
Our brains on scarcity: The trap of not having enough (Part I),https://www.getrichslowly.org/our-brains-on-scarcity-the-trap-of-not-having-enough-part-i/,1301,25 Jun 14,Kristin Wong,36,
Our brains on scarcity: Breaking out of the trap (Part II),https://www.getrichslowly.org/our-brains-on-scarcity-breaking-out-of-the-trap-part-ii/,1367,26 Jun 14,Kristin Wong,17,
Dissecting retirement savings,https://www.getrichslowly.org/dissecting-retirement-savings/,1043,30 Jun 14,Lisa Aberle,34,
Ask the Readers: Are these good enough reasons to buy life insurance?,https://www.getrichslowly.org/ask-the-readers-are-these-good-enough-reasons-to-buy-life-insurance/,814,27 Jun 14,April Dykman,89,
I was audited by the IRS!,https://www.getrichslowly.org/i-was-audited-by-the-irs/,1456,03 Jul 14,J.D. Roth,44,
Reader Stories: 4 ways to make money with your old junk,https://www.getrichslowly.org/reader-stories-four-ways-to-make-money-with-your-old-junk/,785,06 Jul 14,Get Rich Slowly Editors,21,
Student loan debt: Learning to save yourself,https://www.getrichslowly.org/student-loan-debt-learning-to-save-yourself/,1471,02 Jul 14,Holly Johnson,116,
Weird ways our brains control our money habits,https://www.getrichslowly.org/weird-ways-our-brains-control-our-money-habits/,1120,09 Jul 14,Kristin Wong,22,
Are you ready for a major power outage?,https://www.getrichslowly.org/are-you-ready-for-a-major-power-outage/,1814,08 Jul 14,William Cowie,68,
More on motivation and money,https://www.getrichslowly.org/more-on-motivation-and-money/,1107,07 Jul 14,Honey Smith,29,
Ask the Readers: Do singles need to plan differently for retirement?,https://www.getrichslowly.org/ask-the-readers-do-singles-need-to-plan-differently-for-retirement/,853,11 Jul 14,Ellen Cannon,35,
Car payments: 'Til death do us part,https://www.getrichslowly.org/car-payments-til-death-do-us-part/,1185,10 Jul 14,Holly Johnson,81,
Reader Story: Update on a dad in need of retirement help,https://www.getrichslowly.org/reader-story-update-on-a-dad-in-need-of-retirement-help/,941,13 Jul 14,Ellen Cannon,27,
Breaking the stress spending cycle,https://www.getrichslowly.org/breaking-the-stress-spending-cycle/,1066,16 Jul 14,Kristin Wong,36,
Don't let your emotions drive your car-buying decisions,https://www.getrichslowly.org/dont-let-your-emotions-drive-your-car-buying-decisions/,1126,17 Jul 14,Financial Samurai,35,
Change is hard: Willpower versus habit,https://www.getrichslowly.org/change-is-hard-willpower-versus-habit/,1104,21 Jul 14,Honey Smith,19,
"What to do during the ""What's Next?"" stage of finance",https://www.getrichslowly.org/what-to-do-during-the-whats-next-stage-of-finance/,1315,23 Jul 14,Kristin Wong,43,
Why you must teach your children about money,https://www.getrichslowly.org/why-you-must-teach-your-children-about-money/,1849,24 Jul 14,Donna Freedman,52,
Money extremes: From spendthrift to tightwad to somewhere in the middle,https://www.getrichslowly.org/money-extremes-from-spendthrift-to-tightwad-to-somewhere-in-the-middle/,1120,29 Jul 14,April Dykman,22,
"No, the American dream doesn't cost 130K",https://www.getrichslowly.org/no-the-american-dream-doesnt-cost-130k/,1159,30 Jul 14,Holly Johnson,83,
Ask the Readers: How do you know if a vet procedure is really necessary?,https://www.getrichslowly.org/ask-the-readers-how-do-you-know-if-a-vet-procedure-is-really-necessary/,849,01 Aug 14,April Dykman,74,
Reader Story: Could crowd funding help this guy pay off his mortgage?,https://www.getrichslowly.org/crowd-funding-pay-off-mortgage/,1206,03 Aug 14,Ellen Cannon,239,
"The ""Ivory Tower"": Reconsidering the college investment",https://www.getrichslowly.org/ivory-tower-reconsidering-college-investment/,1316,06 Aug 14,Kristin Wong,62,
Honey progress report: More milestones edition,https://www.getrichslowly.org/honey-progress-report-more-milestones-edition/,1106,04 Aug 14,Honey Smith,65,
Ask the Readers: What is your personal finance calculus?,https://www.getrichslowly.org/ask-the-readers-what-is-your-personal-finance-calculus/,574,08 Aug 14,Get Rich Slowly Editors,31,
An updated reckoning and why we became homeowners: Honey's story,https://www.getrichslowly.org/an-updated-reckoning-and-why-we-became-homeowners-honeys-story/,1072,07 Aug 14,Honey Smith,81,
Reader Stories: How I am financing retirement,https://www.getrichslowly.org/reader-stories-how-i-am-financing-retirement/,1313,10 Aug 14,Get Rich Slowly Editors,39,
How to eat on $4/day,https://www.getrichslowly.org/how-to-eat-on-4day/,1071,12 Aug 14,April Dykman,55,
Breaking taboo: Ask your friends and family for financial advice,https://www.getrichslowly.org/breaking-taboo-ask-your-friends-and-family-for-financial-advice/,1186,14 Aug 14,J.D. Roth,49,
The daycare debate: A double-edged sword,https://www.getrichslowly.org/the-daycare-debate-a-double-edged-sword/,1589,13 Aug 14,Holly Johnson,120,
Ask the Readers: How do you function with bad credit or no credit?,https://www.getrichslowly.org/ask-the-readers-how-do-you-function-with-bad-credit-or-no-credit/,624,15 Aug 14,Get Rich Slowly Editors,61,
What to consider before you invest in a college education,https://www.getrichslowly.org/what-to-consider-before-you-invest-in-a-college-education/,1202,18 Aug 14,Honey Smith,27,
Approaching retirement: What now?,https://www.getrichslowly.org/approaching-retirement-what-now/,1732,19 Aug 14,William Cowie,40,
What kind of insurance do drivers like me buy?,https://www.getrichslowly.org/what-kind-of-insurance-do-drivers-like-me-buy/,644,21 Aug 14,Ellen Cannon,33,
Challenging traditional measures of financial success: Homeownership,https://www.getrichslowly.org/challenging-traditional-measures-of-financial-success-homeownership/,1320,20 Aug 14,Kristin Wong,155,
Ask the Readers: How do you balance multiple sinking funds?,https://www.getrichslowly.org/ask-the-readers-how-do-you-balance-multiple-sinking-funds/,575,22 Aug 14,Get Rich Slowly Editors,58,
Reader Stories: Your debt-paying personality,https://www.getrichslowly.org/reader-stories-your-debt-paying-personality/,945,24 Aug 14,Get Rich Slowly Editors,24,
Preventing failure before it is an option,https://www.getrichslowly.org/preventing-failure-before-it-is-an-option/,1015,25 Aug 14,Lisa Aberle,29,
Hiccups on the way to combining finances,https://www.getrichslowly.org/hiccups-on-the-way-to-combining-finances/,790,26 Aug 14,J.D. Roth,32,
My unconventional plans to pay for my daughter's college education,https://www.getrichslowly.org/my-unconventional-plans-to-pay-for-my-daughters-college-education/,1423,27 Aug 14,Holly Johnson,42,
The high cost of infertility,https://www.getrichslowly.org/the-high-cost-of-infertility/,1488,28 Aug 14,Get Rich Slowly Editors,42,
What's the definition of success?,https://www.getrichslowly.org/whats-the-definition-of-success/,1094,01 Sep 14,Honey Smith,22,
How to save big with a salvage title,https://www.getrichslowly.org/how-to-save-big-with-a-salvage-title/,1859,02 Sep 14,William Cowie,22,
Looking out for your finances as a renter,https://www.getrichslowly.org/looking-out-for-your-finances-as-a-renter/,874,03 Sep 14,Kristin Wong,26,
Reader Stories: Living in a Car to Pay Off Debt,https://www.getrichslowly.org/reader-stories-living-in-a-car-to-pay-off-debt/,1014,31 Aug 14,Get Rich Slowly Editors,85,
Why I voluntarily slashed my salary,https://www.getrichslowly.org/voluntarily-slashed-salary/,1966,04 Sep 14,Donna Freedman,77,
Bad advice about having a baby I'm glad I followed,https://www.getrichslowly.org/bad-advice-having-a-baby-im-glad-i-followed/,1183,10 Sep 14,Holly Johnson,56,
Starting a garden to pay off debt: Really!?!,https://www.getrichslowly.org/starting-a-garden-to-pay-off-debt-really/,1075,09 Sep 14,April Dykman,87,
The 9-to-5 job: Challenging how we earn a living,https://www.getrichslowly.org/the-9-to-5-job-challenging-how-we-earn-a-living/,1162,11 Sep 14,Kristin Wong,42,
Honey progress report: Homeownership and priorities edition,https://www.getrichslowly.org/honey-progress-report-homeownership-and-priorities-edition/,1104,15 Sep 14,Honey Smith,68,
Reader Stories: How to avoid borrowing from your future self,https://www.getrichslowly.org/reader-stories-how-to-avoid-borrowing-from-your-future-self/,1356,14 Sep 14,Get Rich Slowly Editors,58,
You can learn how to make money investing: Just do it!,https://www.getrichslowly.org/how-to-make-money-investing-just-do-it/,1850,16 Sep 14,William Cowie,40,
A better way to calculate the value of your time,https://www.getrichslowly.org/a-better-way-to-calculate-the-value-of-your-time/,1634,18 Sep 14,Kristin Wong,20,
"Dinner ideas -- cooking ""flexipe"" style to save money",https://www.getrichslowly.org/dinner-ideas-cooking-flexipe-style-save-money/,986,22 Sep 14,Lisa Aberle,41,
What's Wrong with Consumerism and Materialism? Lots,https://www.getrichslowly.org/the-link-between-consumerism-entitlement-and-ego/,1801,17 Sep 14,Kristin Wong,88,
The most money I've ever lost,https://www.getrichslowly.org/the-most-money-ive-ever-lost/,1209,23 Sep 14,April Dykman,31,
Buying rental property: Sometimes getting rich means taking it slowly,https://www.getrichslowly.org/buying-rental-property-sometimes-getting-rich-means-taking-it-slowly/,1356,24 Sep 14,Holly Johnson,52,
"I was intimidated by investing, but here's how I got started",https://www.getrichslowly.org/i-was-intimidated-by-investing-but-heres-how-i-got-started/,1721,25 Sep 14,Kristin Wong,33,
Networking strategies can help you overcome the fear of trying to advance your career,https://www.getrichslowly.org/networking-strategies-can-help-you-overcome-fear/,1141,29 Sep 14,Honey Smith,15,
"Fire: Oh, that will never happen to me",https://www.getrichslowly.org/fire-oh-that-will-never-happen-to-me/,1698,30 Sep 14,William Cowie,45,
How I budget with a variable income,https://www.getrichslowly.org/how-i-budget-with-a-variable-income-2/,998,01 Oct 14,Kristin Wong,22,
New developments in online banking security,https://www.getrichslowly.org/new-developments-in-online-banking-security/,1349,02 Oct 14,William Cowie,13,
Reader Stories: Can you really get rich quickly from fix and flipping homes?,https://www.getrichslowly.org/can-you-really-get-rich-quickly-from-fix-and-flipping-homes/,3369,05 Oct 14,Get Rich Slowly Editors,48,
My Experience With Alternative Health Insurance To Obamacare,https://www.getrichslowly.org/my-experience-with-alternative-healthcare-insurance/,1165,06 Oct 14,Lisa Aberle,93,
The Happiness of Pursuit,https://www.getrichslowly.org/the-happiness-of-pursuit/,1325,07 Oct 14,April Dykman,29,
The problem with being goal-oriented,https://www.getrichslowly.org/the-problem-with-being-goal-oriented/,1729,09 Oct 14,Kristin Wong,44,
Ask the Readers: How much does a creative costume cost to make?,https://www.getrichslowly.org/how-much-does-a-creative-costume-cost-to-make/,436,10 Oct 14,Get Rich Slowly Editors,32,
Should Cash be Part of Your Emergency Fund?,https://www.getrichslowly.org/should-cash-be-part-of-your-emergency-fund/,1136,13 Oct 14,Honey Smith,59,
How not to approach rising home prices,https://www.getrichslowly.org/how-not-to-approach-rising-home-prices/,1532,14 Oct 14,William Cowie,33,
5 key retirement factors your financial plan may not address,https://www.getrichslowly.org/5-key-retirement-factors-your-financial-plan-may-not-address/,1086,16 Oct 14,Robert Brokamp,29,
Lifestyle inflation: How to decide if it's ever okay,https://www.getrichslowly.org/lifestyle-inflation-how-to-decide-if-its-ever-okay/,1664,15 Oct 14,Kristin Wong,81,
9 reasons you may never retire,https://www.getrichslowly.org/9-reasons-you-may-never-retire/,1828,21 Oct 14,William Cowie,45,
Ask the readers: Are home security systems worth the money?,https://www.getrichslowly.org/ask-the-readers-are-home-security-systems-worth-the-money/,625,17 Oct 14,Get Rich Slowly Editors,61,
Can Getting One Month Ahead Save Your Budget?,https://www.getrichslowly.org/can-getting-one-month-ahead-save-your-budget/,1415,22 Oct 14,Holly Johnson,44,
To what do you attribute your success -- hard work or good fortune?,https://www.getrichslowly.org/to-what-do-you-attribute-your-success-hard-work-or-good-fortune/,1045,23 Oct 14,Kristin Wong,34,
What does your job tenure say about you?,https://www.getrichslowly.org/what-does-your-job-tenure-say-about-you/,1197,27 Oct 14,Honey Smith,27,
Ask the readers: Should we get married sooner to lower our taxes?,https://www.getrichslowly.org/ask-the-readers-should-we-get-married-sooner-to-lower-our-taxes/,734,24 Oct 14,Get Rich Slowly Editors,61,
What can we learn from Gen Y's view of money?,https://www.getrichslowly.org/what-can-we-learn-from-gen-ys-view-of-money/,1247,29 Oct 14,Kristin Wong,25,
Average 401(k) Balance by Age,https://www.getrichslowly.org/is-your-401k-keeping-up-with-the-joneses/,800,30 Oct 14,Robert Brokamp,44,
Investing: Two ways to beat average returns,https://www.getrichslowly.org/investing-two-ways-to-beat-average-returns/,1972,28 Oct 14,William Cowie,61,
Ask the Readers: Is financial ability intrinsic or learned?,https://www.getrichslowly.org/ask-the-readers-is-financial-ability-intrinsic-or-learned/,1477,31 Oct 14,Get Rich Slowly Editors,25,
Is living without credit cards the best way to stay out of debt?,https://www.getrichslowly.org/is-living-without-credit-cards-the-best-way-to-stay-out-of-debt/,1438,04 Nov 14,Holly Johnson,50,
How to curate your social media presence when job-hunting,https://www.getrichslowly.org/how-to-curate-your-social-media-presence-when-job-hunting/,1124,06 Nov 14,Honey Smith,16,
