title,link,word_count,date,author,comments_count,notes
"What To Do with All That Clutter: Sell It, Swap It, Give It Away",https://www.getrichslowly.org/what-to-do-with-all-that-clutter-sell-it-swap-it-give-it-away/,1230,12 May 11,Sierra Black,75,
Reader Story: I'm a Sugar Mama (and Proud of It!),https://www.getrichslowly.org/reader-story-im-a-sugar-mama-and-proud-of-it/,951,15 May 11,J.D. Roth,127,
How I Got Suckered into Opening a Store Credit Card,https://www.getrichslowly.org/how-i-got-suckered-into-opening-a-store-credit-card/,1079,16 May 11,April Dykman,154,
Is an MBA Worth It?,https://www.getrichslowly.org/is-an-mba-worth-it/,1377,18 May 11,J.D. Roth,106,
Five Career Moves with Exponential Returns,https://www.getrichslowly.org/five-career-moves-with-exponential-returns/,1071,23 May 11,April Dykman,62,
Reader Story: How I Built My Own House -- Without a Mortgage,https://www.getrichslowly.org/reader-story-how-i-built-my-house-without-a-mortgage/,2633,22 May 11,J.D. Roth,153,
Ask the Readers: What Is My Financial Obligation to My Family?,https://www.getrichslowly.org/ask-the-readers-what-is-my-financial-obligation-to-my-family/,788,13 May 11,J.D. Roth,272,
Book Review: Early Retirement Extreme,https://www.getrichslowly.org/book-review-early-retirement-extreme/,1741,17 May 11,J.D. Roth,212,
A Penny Saved is a Penny Spurned? What to Do with Pockets Full of Change,https://www.getrichslowly.org/a-penny-saved-is-a-penny-spurned-what-to-do-with-pockets-full-of-change/,1429,25 May 11,Donna Freedman,177,
The Basic Allowance for Housing: Helping Military Members Afford a Home,https://www.getrichslowly.org/the-basic-allowance-for-housing-helping-military-members-afford-a-home/,759,30 May 11,J.D. Roth,61,
"Why I hate ""new, unique"" money tips",https://www.getrichslowly.org/why-i-hate-new-unique-money-tips/,964,31 May 11,J.D. Roth,123,
Buying a Home? Pay Attention to Property Inspection,https://www.getrichslowly.org/buying-a-home-pay-attention-to-property-inspection/,1265,01 Jun 11,April Dykman,69,
My Financial Roadmap and Making Course Corrections,https://www.getrichslowly.org/my-financial-roadmap-and-making-course-corrections/,1110,03 Jun 11,Sierra Black,58,
Discounted Gift Cards: The New Coupon,https://www.getrichslowly.org/discounted-gift-cards-the-new-coupon/,1210,06 Jun 11,Donna Freedman,49,
"Ask the Readers: How Can I Handle ""Required"" Office Spending?",https://www.getrichslowly.org/ask-the-readers-how-can-i-handle-required-office-spending/,1096,27 May 11,J.D. Roth,218,
How to Make Separate Finances Work: An Interview with J.D. and Kris,https://www.getrichslowly.org/how-to-make-separate-finances-work-an-interview-with-j-d-and-kris/,2156,07 Jun 11,J.D. Roth,199,
The Psychology of Consumerism,https://www.getrichslowly.org/the-psychology-of-consumerism/,1427,08 Jun 11,J.D. Roth,202,
How to Dispute Your Mechanic Bill,https://www.getrichslowly.org/how-to-dispute-your-mechanic-bill/,1457,09 Jun 11,April Dykman,137,
Putting First Things First,https://www.getrichslowly.org/putting-first-things-first/,880,13 Jun 11,J.D. Roth,74,
Ask the Readers: I'm Getting Older -- Should I Save or Should I Travel?,https://www.getrichslowly.org/ask-the-readers-im-getting-older-should-i-save-or-should-i-travel/,919,10 Jun 11,J.D. Roth,112,
Traffic violations and your auto insurance,https://www.getrichslowly.org/traffic-violations-and-your-auto-insurance/,971,14 Jun 11,April Dykman,60,
Reader Story: The Costs and Savings of Bicycle Commuting,https://www.getrichslowly.org/reader-story-the-costs-and-savings-of-bicycle-commuting/,1081,12 Jun 11,J.D. Roth,186,
Ask the Readers: Pay Off the Mortgage or Keep the Money in Savings?,https://www.getrichslowly.org/ask-the-readers-pay-off-the-mortgage-or-keep-the-money-in-savings/,748,17 Jun 11,J.D. Roth,232,
10 Ways to Build a Gift Closet That's Both Deep and Cheap,https://www.getrichslowly.org/10-ways-to-build-a-gift-closet-thats-both-deep-and-cheap/,1173,22 Jun 11,Donna Freedman,109,
"How My Generosity Got Me $8,000 in Debt",https://www.getrichslowly.org/how-my-generosity-got-me-8000-in-debt/,1273,30 Jun 11,J.D. Roth,105,
Ask the Readers: How Can I Earn Extra Money?,https://www.getrichslowly.org/ask-the-readers-how-can-i-earn-extra-money/,710,24 Jun 11,J.D. Roth,122,
"Big House, Little House",https://www.getrichslowly.org/big-house-little-house/,1336,20 Jun 11,J.D. Roth,273,
Biking vs. Driving Calculator,https://www.getrichslowly.org/biking-vs-driving-calculator/,527,27 Jun 11,J.D. Roth,113,
Best Savings Accounts for 2015,https://www.getrichslowly.org/best-savings-accounts-for-2011/,1063,01 Jul 11,J.D. Roth,106,
Every Purchase Is a Trade-Off,https://www.getrichslowly.org/every-purchase-is-a-trade-off/,907,05 Jul 11,J.D. Roth,76,
How to Spend Money (Even If You Think You Shouldn't),https://www.getrichslowly.org/how-to-spend-money-even-if-you-think-you-shouldnt/,1562,06 Jul 11,Donna Freedman,70,
A Primer on Finding Unclaimed Property,https://www.getrichslowly.org/a-primer-on-finding-unclaimed-property/,1049,07 Jul 11,Sierra Black,75,
Reader Story: The Product of Frugal Parents,https://www.getrichslowly.org/reader-story-the-product-of-frugal-parents/,828,10 Jul 11,J.D. Roth,99,
Ask the Readers: But HOW Do You Track Every Penny You Spend?,https://www.getrichslowly.org/ask-the-readers-but-how-do-you-track-every-penny-you-spend/,940,08 Jul 11,J.D. Roth,186,
Frugal Beauty: How to Look Good on a Budget,https://www.getrichslowly.org/frugal-beauty-how-to-look-good-on-a-budget/,989,12 Jul 11,Sierra Black,292,
Slowly Rich Get with Dividends: Living on Dividends Alone?,https://www.getrichslowly.org/can-you-live-on-dividends-alone/,1069,13 Jul 11,Robert Brokamp,75,
Ask the Readers: Is a Used Car Still a Good Deal?,https://www.getrichslowly.org/ask-the-readers-is-a-used-car-still-a-good-deal/,863,15 Jul 11,J.D. Roth,138,
Reader Story: Negative Budgeting and a Healthy Outlook on Life,https://www.getrichslowly.org/reader-story-negative-budgeting-and-a-healthy-outlook-on-life/,890,17 Jul 11,J.D. Roth,52,
Playing to Your Strengths,https://www.getrichslowly.org/playing-to-your-strengths/,1353,21 Jul 11,Sierra Black,52,
Drama in Real Life: A Place for Mom,https://www.getrichslowly.org/a-place-for-mom/,1610,20 Jul 11,J.D. Roth,261,
"Reader Story: How I Sold My Condo and Saved $5,000",https://www.getrichslowly.org/reader-story-how-i-sold-my-condo-and-saved-5000/,1271,31 Jul 11,J.D. Roth,111,
The financial cost of obesity,https://www.getrichslowly.org/the-financial-cost-of-obesity/,1178,26 Jul 11,April Dykman,233,
Frugal Back-to-School Shopping,https://www.getrichslowly.org/frugal-back-to-school-shopping/,1787,01 Aug 11,Donna Freedman,115,
How to Save on Your Cell Phone Plan with Secret No-Contract Deals,https://www.getrichslowly.org/how-to-save-on-your-cell-phone-plan-with-secret-no-contract-deals/,791,02 Aug 11,J.D. Roth,132,
Playing to Win: Turning Money Management into a Game,https://www.getrichslowly.org/playing-to-win-turning-money-management-into-a-game/,957,03 Aug 11,J.D. Roth,65,
Budgeting Dilemma: How Do You Decide What You Can Afford?,https://www.getrichslowly.org/budgeting-dilemma-how-do-you-decide-what-you-can-afford/,674,04 Aug 11,J.D. Roth,101,
Ask the Readers: How Much Do You Spend on Food?,https://www.getrichslowly.org/ask-the-readers-how-much-do-you-spend-on-food/,681,29 Jul 11,J.D. Roth,399,
Extreme Early Retirement in Practice: How Two People Did It,https://www.getrichslowly.org/extreme-early-retirement-in-practice-how-two-people-did-it/,2123,11 Aug 11,Robert Brokamp,165,
GRS Blogger Profile: Sarah Gilbert,https://www.getrichslowly.org/grs-blogger-profile-sarah-gilbert/,1355,11 Aug 11,Sarah Gilbert,24,
Sunk Costs and Smart Decisions,https://www.getrichslowly.org/sunk-costs-and-smart-decisions/,1168,09 Aug 11,J.D. Roth,147,
When Renting Is Smarter Than Buying,https://www.getrichslowly.org/when-renting-is-smarter-than-buying/,1178,12 Aug 11,Sierra Black,96,
10 Easy Ways to Lower Your Electric Bill,https://www.getrichslowly.org/10-easy-ways-to-lower-your-electric-bill/,1033,15 Aug 11,April Dykman,151,
How to Get Cheap Drugs,https://www.getrichslowly.org/how-to-get-cheap-drugs/,1296,16 Aug 11,Donna Freedman,92,
Is Unlimited Air Travel a Good Deal?,https://www.getrichslowly.org/is-unlimited-air-travel-a-good-deal/,999,18 Aug 11,Sierra Black,37,
How to Learn a Foreign Language Without Spending a Cent,https://www.getrichslowly.org/how-to-learn-a-foreign-language-without-spending-a-cent/,2414,22 Aug 11,J.D. Roth,92,
An Introduction to Arbitrage: Using Craigslist to Make a Living,https://www.getrichslowly.org/an-introduction-to-arbitrage-using-craigslist-to-make-a-living/,1206,17 Aug 11,J.D. Roth,153,
Engineer Your Retirement,https://www.getrichslowly.org/engineer-your-retirement/,1053,24 Aug 11,Robert Brokamp,50,
Smart Ways to Save Money,https://www.getrichslowly.org/the-mighty-power-of-the-lowly-coin-jar-or-how-i-saved-723-in-seven-months-without-effort/,1054,24 Aug 11,Get Rich Slowly Editors,138,
Dissatisfied Customer? Make an Effective Complaint,https://www.getrichslowly.org/disatisfied-customer-make-an-effective-complaint/,1084,23 Aug 11,April Dykman,42,
Decision Fatigue: Why Willpower Isn't Always Enough,https://www.getrichslowly.org/decision-fatigue-why-willpower-isnt-always-enough/,1044,26 Aug 11,Sierra Black,85,
Reader Story: My Falling Credit Score (and Why It's Not the End of the World),https://www.getrichslowly.org/reader-story-my-falling-credit-score-and-why-its-not-the-end-of-the-world/,1185,28 Aug 11,J.D. Roth,88,
How Much Is a Clean Home Worth?,https://www.getrichslowly.org/how-much-is-a-clean-home-worth/,1094,01 Sep 11,Sierra Black,96,
Why I Love the Megabus: A Closer Look at a Seldom-Used (but Cheap!) Way to Travel,https://www.getrichslowly.org/why-i-love-the-megabus-a-closer-look-at-a-seldom-used-but-cheap-way-to-travel/,1108,31 Aug 11,Donna Freedman,129,
Ask the Readers: How to Cope with Financial Mistakes?,https://www.getrichslowly.org/ask-the-readers-how-to-cope-with-financial-mistakes/,1088,02 Sep 11,J.D. Roth,88,
On the Road to Nowhere: The True Story of My First (and Worst) Job,https://www.getrichslowly.org/on-the-road-to-nowhere-the-true-story-of-my-first-and-worst-job/,1745,05 Sep 11,J.D. Roth,67,
Compound Interest vs. Increased Income -- Which Matters More?,https://www.getrichslowly.org/compound-interest-vs-increased-income-which-matters-more/,731,06 Sep 11,J.D. Roth,54,
Reader Story: Winning the Lottery,https://www.getrichslowly.org/reader-story-winning-the-lottery/,791,04 Sep 11,J.D. Roth,120,
What Will You Get from Social Security?,https://www.getrichslowly.org/what-will-you-get-from-social-security/,1551,08 Sep 11,Robert Brokamp,99,
Drugstore Price Comparison: Online vs. In-store,https://www.getrichslowly.org/drugstore-price-comparison-online-vs-in-store/,1109,13 Sep 11,April Dykman,46,
How Much Do We Owe Others? (And When Should We Walk Away?),https://www.getrichslowly.org/how-much-do-we-owe-others-and-when-should-we-walk-away/,1234,12 Sep 11,Donna Freedman,241,
8 little-known facts and benefits of Roth IRA savings,https://www.getrichslowly.org/eight-little-known-facts-about-the-roth-ira/,1493,15 Sep 11,J.D. Roth,105,
Why Leaving My Job in Finance Was the Best Decision Ever,https://www.getrichslowly.org/why-leaving-my-job-in-finance-was-the-best-decision-ever/,842,13 Sep 11,J.D. Roth,41,
Hostels For Adults: Spend Travel Money Where it Counts,https://www.getrichslowly.org/hostels-for-adults-spend-travel-money-where-it-counts/,1069,14 Sep 11,Sarah Gilbert,163,
Old Friends: Scenes from a Class Reunion,https://www.getrichslowly.org/old-friends-scenes-from-a-class-reunion/,1617,19 Sep 11,J.D. Roth,52,
Ask the Readers: How Would You Sell a Collection?,https://www.getrichslowly.org/ask-the-readers-how-would-you-sell-a-collection/,1312,23 Sep 11,J.D. Roth,102,
How Did My Phone Bill Get So High?!? Why You Should Pay Attention to Your Bills,https://www.getrichslowly.org/how-did-my-phone-bill-get-so-high-why-you-should-pay-attention-to-your-bills/,758,26 Sep 11,J.D. Roth,45,
10 Career Lessons from Julia Child,https://www.getrichslowly.org/10-career-lessons-from-julia-child/,1157,27 Sep 11,April Dykman,53,
Ask the Readers: How Much Do You Spend on Clothes?,https://www.getrichslowly.org/ask-the-readers-how-much-do-you-spend-on-clothes/,619,16 Sep 11,J.D. Roth,340,
Free Money from Banks! (But Watch the Fine Print),https://www.getrichslowly.org/free-money-from-banks-but-watch-the-fine-print/,1591,28 Sep 11,Donna Freedman,53,
Food Fight: Does Healthy Food Have to Be More Expensive?,https://www.getrichslowly.org/food-fight-does-healthy-food-have-to-be-more-expensive/,1115,22 Sep 11,April Dykman,286,
Reader Story: How to Buy a Car at Auction,https://www.getrichslowly.org/reader-story-how-to-buy-a-car-at-auction/,1425,09 Oct 11,J.D. Roth,68,
Reader Story: The High Cost of Kids' Sports,https://www.getrichslowly.org/reader-story-the-high-cost-of-kids-sports/,632,02 Oct 11,J.D. Roth,92,
Our Roof Repair: A Typical Tale of Working with Contractors,https://www.getrichslowly.org/our-roof-repair-a-typical-tale-of-working-with-contractors/,1452,10 Oct 11,J.D. Roth,95,
Cashing in on Craigslist: How I've Saved Thousands of Dollars Buying Used,https://www.getrichslowly.org/cashing-in-on-craigslist-how-ive-saved-thousands-of-dollars-buying-used/,2247,17 Oct 11,J.D. Roth,77,
Ask the Readers: Which Financial Products Do You Actually Use?,https://www.getrichslowly.org/ask-the-readers-which-financial-products-do-you-actually-use/,1225,14 Oct 11,J.D. Roth,143,
"Why Pay Debit Card Fees? Changing Banks, or Not",https://www.getrichslowly.org/why-pay-debit-card-fees-changing-banks-or-not/,1417,19 Oct 11,Sarah Gilbert,167,
Reader Story: Using Small Income Streams to Fund Big Goals,https://www.getrichslowly.org/reader-story-using-small-income-streams-to-fund-big-goals/,922,23 Oct 11,J.D. Roth,90,
How to Buy a Pension with a Lifetime Annuity,https://www.getrichslowly.org/how-to-buy-a-pension-with-a-lifetime-annuity/,760,31 Oct 11,J.D. Roth,47,
Reader Story: How Debt Put My Dreams on Hold,https://www.getrichslowly.org/reader-story-how-debt-put-my-dreams-on-hold/,959,30 Oct 11,J.D. Roth,85,
Career Moves: How to Win the Office Politics Game (Part One),https://www.getrichslowly.org/career-moves-how-to-win-the-office-politics-game-part-one/,976,24 Oct 11,April Dykman,47,
No balance transfer fee credit card: SlateÂ® from Chase,https://www.getrichslowly.org/no-balance-transfer-fee-credit-card-chase-slate-0-limited-time-offer/,711,01 Nov 11,Get Rich Slowly Editors,41,
A Closer Look at Bonds,https://www.getrichslowly.org/a-closer-look-at-bonds/,1796,03 Nov 11,Robert Brokamp,33,
Ask the Readers: How Much Do You Spend on Gifts?,https://www.getrichslowly.org/ask-the-readers-how-much-do-you-spend-on-gifts/,579,04 Nov 11,J.D. Roth,126,
The Economics of Country Mouse vs. City Mouse,https://www.getrichslowly.org/the-economics-of-country-mouse-vs-city-mouse/,1117,07 Nov 11,April Dykman,115,
Think Different: Teaching Kids to Be Entrepreneurs,https://www.getrichslowly.org/think-different-teaching-kids-to-be-entrepreneurs/,1341,08 Nov 11,Tim Sullivan,62,
Why I Still Pick Up Pennies,https://www.getrichslowly.org/why-i-still-pick-up-pennies/,1668,10 Nov 11,Donna Freedman,168,
Ask the Readers: How Much Money Do You Need Before You Have Kids?,https://www.getrichslowly.org/ask-the-readers-how-much-money-do-you-need-before-you-have-kids/,801,11 Nov 11,J.D. Roth,268,
Reader Story: The 30-Day No-Restuarant Challenge,https://www.getrichslowly.org/reader-story-the-30-day-no-restuarant-challenge/,828,20 Nov 11,J.D. Roth,136,
Health is Wealth: The Best Investment I Ever Made,https://www.getrichslowly.org/health-is-wealth-the-best-investment-i-ever-made/,1450,21 Nov 11,J.D. Roth,121,
Reader Story: What My Father's Death Taught Me About Estate Planning,https://www.getrichslowly.org/reader-story-what-my-fathers-death-taught-me-about-estate-planning/,1481,27 Nov 11,J.D. Roth,101,
The Best Books About Money,https://www.getrichslowly.org/the-best-books-about-money/,3593,28 Nov 11,J.D. Roth,69,
Getting Over the Overdraft: How I Started Saving,https://www.getrichslowly.org/getting-over-the-overdraft-how-i-started-saving/,1130,05 Dec 11,Tim Sullivan,56,
Why Most of Us Won't Change Banks,https://www.getrichslowly.org/why-most-of-us-wont-change-banks/,1513,01 Dec 11,Sarah Gilbert,73,
Spend on the Things You Do Every Day,https://www.getrichslowly.org/spend-on-the-things-you-do-every-day/,941,15 Nov 11,April Dykman,133,
Why Financial Literacy Fails (and What to Do About It),https://www.getrichslowly.org/why-financial-literacy-fails-and-what-to-do-about-it/,1484,07 Dec 11,J.D. Roth,166,
Ask the Readers: How to Help a Homeless Friend?,https://www.getrichslowly.org/ask-the-readers-how-to-help-a-homeless-friend/,793,09 Dec 11,J.D. Roth,119,
Protecting Yourself Against Sexually-Transmitted Debt,https://www.getrichslowly.org/protecting-yourself-against-sexually-transmitted-debt/,1654,12 Dec 11,J.D. Roth,54,
The Night That Mama Cried While Angels Sang,https://www.getrichslowly.org/the-night-that-mama-cried-while-angels-sang-2/,1241,24 Dec 11,J.D. Roth,25,
Planning for My Financial Future,https://www.getrichslowly.org/planning-for-my-financial-future/,945,26 Dec 11,J.D. Roth,65,
Reader Story: Recovering from Divorce,https://www.getrichslowly.org/reader-story-recovering-from-divorce/,743,18 Dec 11,J.D. Roth,70,
Ask the Readers: How Much Do You Spend on Health Insurance?,https://www.getrichslowly.org/ask-the-readers-how-much-do-you-spend-on-health-insurance/,367,16 Dec 11,J.D. Roth,337,
12 Steps to Financial Freedom,https://www.getrichslowly.org/12-steps-to-financial-freedom-in-2012/,3334,01 Jan 12,J.D. Roth,47,
Expectations and Your Money,https://www.getrichslowly.org/expectations-and-money/,1346,29 Dec 11,Sarah Gilbert,56,
Everything You Need to Know about Using Credit Card Bonuses for Free Travel,https://www.getrichslowly.org/everything-you-need-to-know-about-using-credit-card-bonuses-for-free-travel/,1810,27 Dec 11,April Dykman,86,
20 Ways to Spend $20,https://www.getrichslowly.org/20-ways-to-spend-20/,1512,03 Jan 12,Donna Freedman,77,
Kickstart New Habits with a 30-Day Challenge,https://www.getrichslowly.org/kickstart-new-habits-with-a-30-day-challenge/,1043,05 Jan 12,April Dykman,52,
5 Unusual Ways to Raise Successful Children,https://www.getrichslowly.org/5-unusual-ways-to-raise-successful-children/,1022,04 Jan 12,April Dykman,105,
Four-Week Financial Boot Camp,https://www.getrichslowly.org/four-week-financial-boot-camp/,522,06 Jan 12,April Dykman,6,
Reader Story: Can a Saver Learn to Spend?,https://www.getrichslowly.org/reader-story-can-a-saver-learn-to-spend/,1838,08 Jan 12,J.D. Roth,61,
How to Fend Off Financial Trolls,https://www.getrichslowly.org/how-to-fend-off-financial-trolls/,901,09 Jan 12,J.D. Roth,34,
Ask the Readers: When Is It Okay to Use Your Emergency Fund?,https://www.getrichslowly.org/ask-the-readers-when-is-it-okay-to-use-your-emergency-fund/,605,06 Jan 12,J.D. Roth,101,
What Really Makes Your Retirement Accounts Grow,https://www.getrichslowly.org/what-really-makes-your-retirement-accounts-grow/,770,12 Jan 12,Robert Brokamp,77,
Frugality Advice from Millionaires,https://www.getrichslowly.org/frugal-advice-from-millionaires/,1319,10 Jan 12,April Dykman,59,
Ask the Readers: How Much Should I Save (and What Should I Save For)?,https://www.getrichslowly.org/ask-the-readers-how-much-should-i-save-and-what-should-i-save-for/,794,13 Jan 12,J.D. Roth,107,
Reader Story: Turning a Side Hustle into Self Employment,https://www.getrichslowly.org/reader-story-turning-a-side-hustle-into-self-employment/,1281,15 Jan 12,J.D. Roth,155,
How to negotiate your salary,https://www.getrichslowly.org/how-to-negotiate-your-salary/,1203,20 Jan 12,April Dykman,73,
Stealth Savings: Sneaky Ways to Fatten Your Account,https://www.getrichslowly.org/stealth-savings-sneaky-ways-to-fatten-your-account/,1666,18 Jan 12,Donna Freedman,110,
How to stock your liquor cabinet on the cheap,https://www.getrichslowly.org/how-to-stock-your-liquor-cabinet-on-the-cheap/,996,25 Jan 12,Tim Sullivan,108,
How we paid cash for our first home,https://www.getrichslowly.org/how-we-paid-cash-for-our-first-home/,1036,23 Jan 12,J.D. Roth,268,
11 Things You May Not Know About Retirement Accounts,https://www.getrichslowly.org/11-things-you-may-not-know-about-retirement-accounts/,1630,26 Jan 12,Robert Brokamp,60,
Ask the Readers: Basic Financial Frameworks?,https://www.getrichslowly.org/ask-the-readers-basic-financial-frameworks/,1341,27 Jan 12,J.D. Roth,81,
"Reader Story: A Frugal, Happy Life",https://www.getrichslowly.org/reader-story-a-frugal-happy-life/,969,22 Jan 12,J.D. Roth,95,
A Place of My Own,https://www.getrichslowly.org/a-place-of-my-own/,1122,16 Jan 12,J.D. Roth,577,
Spare Change: Submit Your Story Edition,https://www.getrichslowly.org/spare-change-submit-your-story-edition/,591,26 Jan 12,J.D. Roth,32,
How to Donate Your Body to Science,https://www.getrichslowly.org/how-to-donate-your-body-to-science/,1214,30 Jan 12,Donna Freedman,151,
Reader Story: Why I Lied About Money,https://www.getrichslowly.org/reader-story-why-i-lied-about-money/,1091,05 Feb 12,J.D. Roth,84,
Let Go of the Spatula: Reconsidering Wedding Registries,https://www.getrichslowly.org/let-go-of-the-spatula-reconsidering-wedding-registries/,1049,01 Feb 12,Tim Sullivan,238,
How to Spend a Tax Refund,https://www.getrichslowly.org/how-to-spend-a-tax-refund/,1660,02 Feb 12,Lisa Aberle,150,
How One Decision Can Help You Retire Faster,https://www.getrichslowly.org/how-one-decision-can-help-you-retire-faster/,774,09 Feb 12,April Dykman,154,
How and Why I Sold Get Rich Slowly,https://www.getrichslowly.org/how-and-why-i-sold-get-rich-slowly/,3210,31 Jan 12,J.D. Roth,327,
Three Game Plans for a DIY Valentine's Day,https://www.getrichslowly.org/three-game-plans-for-an-affordable-valentines-day/,1044,10 Feb 12,April Dykman,72,
How to Have More Money,https://www.getrichslowly.org/how-to-have-more-money/,2868,13 Feb 12,J.D. Roth,84,
Paying for College: A High School Student's Quest to Stay Debt-Free,https://www.getrichslowly.org/paying-for-college-a-high-school-students-quest-to-stay-debt-free/,684,15 Feb 12,April Dykman,129,
Can Money Buy Freedom?,https://www.getrichslowly.org/can-money-buy-freedom/,1282,06 Feb 12,J.D. Roth,124,
Going to the (Organic) Mattresses,https://www.getrichslowly.org/going-to-the-organic-mattresses/,1311,16 Feb 12,April Dykman,143,
Five easy ways to save money,https://www.getrichslowly.org/easy-ways-to-save-money/,1750,21 Feb 12,Sarah Gilbert,106,
How Safe Is Your Cash?,https://www.getrichslowly.org/how-safe-is-your-cash/,1139,22 Feb 12,Robert Brokamp,51,
Want to Save on Groceries? Cook like a Peasant,https://www.getrichslowly.org/want-to-save-on-groceries-cook-like-a-peasant/,881,23 Feb 12,April Dykman,145,
Reader Story: Home Haircuts Can Save Time and Money,https://www.getrichslowly.org/reader-story-home-haircuts/,802,26 Feb 12,J.D. Roth,133,
Ask the Readers: How to Retire Early?,https://www.getrichslowly.org/ask-the-readers-how-to-retire-early/,1109,24 Feb 12,J.D. Roth,124,
Tax Prep Tips: Is Cheaper Always Better?,https://www.getrichslowly.org/tax-prep-tips-is-cheaper-always-better/,1846,29 Feb 12,April Dykman,86,
Home insurance and pipes that go 'pop' in the night,https://www.getrichslowly.org/home-insurance-and-pipes-that-go-pop-in-the-night/,1075,27 Feb 12,April Dykman,76,
Ask the Readers: All I Ever Worry About is Money,https://www.getrichslowly.org/ask-the-readers-all-i-ever-worry-about-is-money/,1226,04 Mar 12,J.D. Roth,183,
Four Reasons to Invest Internationally,https://www.getrichslowly.org/four-reasons-to-invest-internationally/,949,06 Mar 12,Robert Brokamp,40,
Ask the Readers: How Much Do You Spend on Housing?,https://www.getrichslowly.org/ask-the-readers-how-much-do-you-spend-on-housing/,571,17 Feb 12,J.D. Roth,462,
How Retailers Manipulate Consumers,https://www.getrichslowly.org/how-retailers-manipulate-consumers/,588,06 Mar 12,J.D. Roth,90,
Class Consciousness and Social Mobility,https://www.getrichslowly.org/class-consciousness-and-social-mobility/,2033,05 Mar 12,J.D. Roth,241,
The Cost of Being an Overachiever,https://www.getrichslowly.org/the-cost-of-being-an-overachiever/,866,08 Mar 12,April Dykman,108,
Consumer Reports Auto Issue: Best and Worst Cars for 2012,https://www.getrichslowly.org/consumer-reports-auto-issue-best-and-worst-cars-for-2012/,938,12 Mar 12,J.D. Roth,59,
Reader Story: Re-Evaluating the Rat Race,https://www.getrichslowly.org/reader-story-re-evaluating-the-rat-race/,867,11 Mar 12,J.D. Roth,168,
Prepare to get sick,https://www.getrichslowly.org/prepare-to-get-sick/,1779,13 Mar 12,Donna Freedman,168,
Ask the Readers: Income? Or Negative Savings?,https://www.getrichslowly.org/ask-the-readers-income-or-negative-savings/,879,16 Mar 12,J.D. Roth,93,
Cheap Ways to Relieve Your Aching Back,https://www.getrichslowly.org/cheap-ways-to-relieve-your-aching-back/,1616,20 Mar 12,April Dykman,88,
Continuing Education May Make You Wiser -- But Richer?,https://www.getrichslowly.org/continuing-education-may-make-you-wiser-but-richer/,1849,22 Mar 12,Sarah Gilbert,100,
This I Believe: 43 Lessons from 43 Years,https://www.getrichslowly.org/this-i-believe-43-lessons-from-43-years/,2905,25 Mar 12,J.D. Roth,94,
27 Frugal Uses for a Dead Phone Book,https://www.getrichslowly.org/27-frugal-uses-for-a-dead-phone-book/,1439,26 Mar 12,Donna Freedman,70,
What is a Roth IRA? A Short and Simple Guide,https://www.getrichslowly.org/what-is-a-roth-ira-a-short-and-simple-guide/,1385,27 Mar 12,J.D. Roth,85,
Reader Story: I Quit My Passion and Took a Boring Job,https://www.getrichslowly.org/reader-story-i-quit-my-passion-and-took-a-boring-job/,1535,18 Mar 12,J.D. Roth,246,
