title,link,word_count,date,author,comments_count,notes
How to Make Goblet Squats Harder Without Adding More Weight,http://www.niashanks.com/make-goblet-squats-harder/,1271,"January 9, 2018",Nia Shanks,,
You Owe It to Yourself to Give Fewer Shits,http://www.niashanks.com/give-fewer-shits/,1152,"January 16, 2018",Nia Shanks,,
The Huge Problem With Guilty-Pleasure Foods,http://www.niashanks.com/problem-with-guilty-pleasure-foods/,683,"January 24, 2018",Nia Shanks,,
Screw Fat Loss,http://www.niashanks.com/screw-fat-loss/,2066,"February 1, 2018",Nia Shanks,,
"For the Best Results, Women Must Use Fractional Plates for Barbell Exercises",http://www.niashanks.com/women-fractional-plates-barbell-exercises/,1591,"February 13, 2018",Nia Shanks,,
The Nocebo Effect: Are You (Unknowingly) Thinking Your Way to Failure?,http://www.niashanks.com/nocebo-effect-thinking-your-way-to-failure/,1097,"February 27, 2018",Nia Shanks,,
Squats Don't Work Your Glutes (Because You're Squatting Wrong),http://www.niashanks.com/squats-dont-work-your-glutes/,1641,"March 13, 2018",Nia Shanks,,
Eating in Moderation: How to Do It Right,http://www.niashanks.com/eating-in-moderation/,1890,"March 27, 2018",Nia Shanks,,
Why That Diet Didn't Work for You,http://www.niashanks.com/why-that-diet-didnt-work/,1685,"September 26, 2017",Nia Shanks,,
7 Things That Happen When You Start Strength Training (And a Word of Caution),http://www.niashanks.com/7-things-happen-start-strength-training/,1940,"September 19, 2017",Nia Shanks,,
"When Life is a Raging Dumpster Fire, Lead With Your Ass",http://www.niashanks.com/life-raging-dumpster-fire/,545,"October 9, 2017",Nia Shanks,,
One Simple Hack to Stop Screwing Yourself Over,http://www.niashanks.com/one-simple-hack-stop-screwing/,1109,"October 23, 2017",Nia Shanks,,
"23 Tips to Make Fitness a Miserable, Soul-Sucking Endeavor!",http://www.niashanks.com/23-tips-hate-way-fitness/,3462,"December 5, 2017",Nia Shanks,,
"""Real Women"" Don't Fit in a One-Size-Fits-All Mold",http://www.niashanks.com/real-women-one-size-fits-all-mold/,650,"May 25, 2017",Nia Shanks,,
Fitness Goals for Women (That Don't Have a Damn Thing to do With Fat Loss),http://www.niashanks.com/fitness-goals-for-women/,711,"December 27, 2017",Nia Shanks,,
"Remarkable ""Before & Afters"" That Have Nothing to do With Fat Loss",http://www.niashanks.com/remarkable-before-afters-fat-loss/,1427,"December 12, 2017",Nia Shanks,,
"When to Work Harder, How to Work Smarter, and When to do Both",http://www.niashanks.com/work-harder-work-smarter/,2775,"June 5, 2017",Nia Shanks,,
How to Squat,http://www.niashanks.com/how-to-squat/,1534,"June 21, 2017",Nia Shanks,,
Break Free from the Ugly Side of Health and Fitness,http://www.niashanks.com/break-free-ugly-side-health-fitness/,902,"January 1, 2018",Nia Shanks,,
How to Deadlift (And Why Everyone Should),http://www.niashanks.com/how-to-deadlift-why-everyone-should/,1278,"July 5, 2017",Nia Shanks,,
How to Correctly Perform Barbell Rows and Chin-ups,http://www.niashanks.com/how-to-perform-barbell-rows-chin-ups/,895,"August 21, 2017",Nia Shanks,,
How to Perform The Bench Press And Standing Press (And Why You Should),http://www.niashanks.com/how-to-perform-bench-press-standing-press/,1702,"July 20, 2017",Nia Shanks,,
"18 Uncomfortable Truths About Nutrition, Health, and Fitness",http://www.niashanks.com/uncomfortable-truths-nutrition-health-fitness/,3722,"August 2, 2017",Nia Shanks,,
How Can You Get Back Dimples With Exercise?,http://www.niashanks.com/back-dimples/,941,"February 16, 2017",Nia Shanks,,
The Busy Woman's Guide to Strength Training,http://www.niashanks.com/busy-womans-guide-strength-training/,2480,"February 28, 2017",Nia Shanks,,
Should Women Fix Their Flaws?,http://www.niashanks.com/women-fix-flaws/,1231,"March 17, 2017",Nia Shanks,,
5 Mistakes Women Make With Strength Training (And How to Correct Them),http://www.niashanks.com/mistakes-women-make-strength-training/,2446,"March 22, 2017",Nia Shanks,,
What To Do When You Eat Healthy But Can't Lose Weight,http://www.niashanks.com/eat-healthy-cant-lose-weight/,1795,"April 11, 2017",Nia Shanks,,
Disliking Your Body Doesn't Have to be ‘Part of Being a Woman',http://www.niashanks.com/disliking-body-part-of-being-woman/,1941,"April 21, 2017",Nia Shanks,,
What To Do If Your Genetics Suck,http://www.niashanks.com/genetics-suck/,1335,"May 5, 2017",Nia Shanks,,
Good Things That Get Ruined When Taken to Extremes,http://www.niashanks.com/good-things-ruined-taken-extremes/,1100,"May 11, 2017",Nia Shanks,,
The Shortest Motivation Advice (That's Actually Useful),http://www.niashanks.com/shortest-motivation-advice/,247,"November 15, 2016",Nia Shanks,,
Why I Refuse to ‘Embrace My Flaws' (And You Should Too),http://www.niashanks.com/stop-telling-women-embrace-flaws/,564,"November 21, 2016",Nia Shanks,,
32 Beautiful Badass Strength Training Tips and Principles,http://www.niashanks.com/beautiful-badass-strength-training-tips-principles/,4463,"December 13, 2016",Nia Shanks,,
New Year's Resolution Failure Rate is Woefully High. Use These 11 Tips to Beat The Odds.,http://www.niashanks.com/new-years-resolution-failure-tips/,1319,"December 26, 2016",Nia Shanks,,
Achieving Goals is Hard and Most People Fail. Here's How to (Finally) Succeed.,http://www.niashanks.com/achieving-goals-how-to-succeed/,3661,"January 3, 2017",Nia Shanks,,
10 Overlooked Reasons Why Every Woman Should Strength Train,http://www.niashanks.com/every-woman-strength-train/,1791,"January 11, 2017",Nia Shanks,,
Don't Respond Emotionally to Health and Fitness Slip-Ups,http://www.niashanks.com/respond-emotionally-health-fitness-slip-ups/,1062,"September 7, 2017",Nia Shanks,,
My Experience Trying to ‘Hate My Way' Back to Skinny,http://www.niashanks.com/hate-way-back-skinny/,3067,"January 25, 2017",Nia Shanks,,
The Strength Training Guide for Women Over 40,http://www.niashanks.com/strength-training-women-over-40/,5839,"February 8, 2017",Nia Shanks,,
Not Motivated to Work Out? Do This.,http://www.niashanks.com/not-motivated-to-work-out/,548,"August 30, 2016",Nia Shanks,,
How to Get (And Stay) Motivated to Work Out,http://www.niashanks.com/how-to-get-motivated-work-out/,1816,"September 7, 2016",Nia Shanks,,
"When ""Just Love Your Body"" Is Stupid Advice",http://www.niashanks.com/love-your-body-stupid-advice/,1349,"September 13, 2016",Nia Shanks,,
14 Unconventional Tips to Achieve Your Goals,http://www.niashanks.com/unconventional-tips-achieve-goals/,2313,"September 21, 2016",Nia Shanks,,
Struggling to Build a Fit And Healthy Body? You Must Do This.,http://www.niashanks.com/struggling-build-fit-and-healthy-body/,1275,"October 4, 2016",Nia Shanks,,
Motivation is a Scam,http://www.niashanks.com/motivation-is-a-scam/,1521,"October 11, 2016",Nia Shanks,,
Your Choices Make All The Difference,http://www.niashanks.com/choices-make-difference/,241,"October 19, 2016",Nia Shanks,,
The Double Progression Method: Elevate Your Strength Training Workout,http://www.niashanks.com/double-progression-method/,1979,"November 2, 2016",Nia Shanks,,
Why We Have Heroes (And How to Become Your Own),http://www.niashanks.com/heroes-become-your-own/,792,"June 9, 2016",Nia Shanks,,
The Best (And Easiest) Brussels Sprouts Recipe Ever,http://www.niashanks.com/best-brussels-sprouts-recipe/,470,"June 16, 2016",Nia Shanks,,
4 Tips to Feel Great With Strength Training,http://www.niashanks.com/tips-feel-great-strength-training/,1400,"June 28, 2016",Nia Shanks,,
The Mind-Boggling Bullshit of Health and Fitness,http://www.niashanks.com/bullshit-health-fitness/,1809,"July 7, 2016",Nia Shanks,,
Leesa Mattress Review (A Bed That Comes in a Box. How Good Can It Be?),http://www.niashanks.com/leesa-mattress-review/,1724,"July 19, 2016",Nia Shanks,,
Another Woman's Body is Not Your Measuring Stick,http://www.niashanks.com/my-body-is-not-your-measuring-stick/,635,"July 26, 2016",Nia Shanks,,
How to be a Beautiful Badass (Free Mini Course),http://www.niashanks.com/how-to-be-a-beautiful-badass-free-mini-course/,668,"August 4, 2016",Nia Shanks,,
"The ""All or Nothing"" Approach Has Failed, Miserably.",http://www.niashanks.com/all-or-nothing-approach/,995,"August 15, 2016",Nia Shanks,,
Why I Don't Have Sales or Offer Discounts,http://www.niashanks.com/no-sales-discounts/,757,"April 27, 2016",Nia Shanks,,
16 Things Only People Who Love Strength Training Will Understand,http://www.niashanks.com/love-strength-training/,1183,"April 20, 2016",Nia Shanks,,
"9 Ways for Women to Be More, Not Less (Infographic)",http://www.niashanks.com/women-be-more-not-less-infographic/,386,"May 26, 2016",Nia Shanks,,
The Ugly Side of Health and Fitness,http://www.niashanks.com/ugly-side-health-fitness/,1532,"May 2, 2016",Nia Shanks,,
Think You Can Fail Only If You Try? Think Again.,http://www.niashanks.com/redefining-failure-2/,1120,"May 10, 2016",Nia Shanks,,
"When Life Hands You Problems, Use This Flowchart",http://www.niashanks.com/life-problems/,1018,"May 18, 2016",Nia Shanks,,
10 Benefits to Not Caring About What Other People Think of You,http://www.niashanks.com/benefits-not-caring-people-think/,1572,"May 24, 2016",Nia Shanks,,
The Ultimate Lift Like a Girl Workout Template,http://www.niashanks.com/ultimate-lift-like-girl-workout-template/,1590,"June 2, 2016",Nia Shanks,,
How You Look Is The Least Important Part of Fitness,http://www.niashanks.com/you-dont-know-fit/,572,"March 1, 2016",Nia Shanks,,
Perfection Is Possible (But Not The Way You Think),http://www.niashanks.com/perfection-possible/,753,"February 23, 2016",Nia Shanks,,
Shut Up and Do Something,http://www.niashanks.com/shut-up-and-do-something/,1046,"March 8, 2016",Nia Shanks,,
You Can't Lose Fat (or Keep It Off) Because You're Making These 9 Fat Loss Mistakes,http://www.niashanks.com/9-fat-loss-mistakes/,3158,"March 15, 2016",Nia Shanks,,
"Every Day Can't be Awesome, And That's OK",http://www.niashanks.com/every-day-cant-be-awesome/,556,"April 1, 2016",Nia Shanks,,
5 Books That Will Make Your Life Better,http://www.niashanks.com/books-that-will-make-your-life-better/,1455,"March 22, 2016",Nia Shanks,,
"The Number One Rule to Not Suck at Life, in Only Four Words",http://www.niashanks.com/one-rule-not-suck-life/,705,"April 7, 2016",Nia Shanks,,
Working Out Shouldn't Hurt and Your Diet Shouldn't be Miserable,http://www.niashanks.com/working-out-shouldnt-hurt/,1375,"April 13, 2016",Nia Shanks,,
Leigh Peele Unplugged: What's Wrong and Right in Health and Fitness,http://www.niashanks.com/leigh-peele/,369,"December 31, 2015",Nia Shanks,,
7 Most Empowering Lift Like a Girl Articles You Need to Read,http://www.niashanks.com/empowering-lift-like-a-girl-articles/,475,"January 4, 2016",Nia Shanks,,
The Fat Loss Diet and Workout Program You Tried Completely Failed. This is What You Should Do.,http://www.niashanks.com/fat-loss-diet-program-failed/,366,"January 11, 2016",Nia Shanks,,
5 Health and Fitness Principles That Don't Suck,http://www.niashanks.com/health-fitness-principles/,627,"January 20, 2016",Nia Shanks,,
The Dirty Little Secret about Motivation,http://www.niashanks.com/dirty-secret-motivation/,1207,"February 3, 2016",Nia Shanks,,
Screw Perfection,http://www.niashanks.com/screw-perfection/,1987,"January 26, 2016",Nia Shanks,,
The Lift Like a Girl Challenge,http://www.niashanks.com/challenge/,670,"February 16, 2016",Nia Shanks,,
Why Having Year Long Goals Doesn't Work,http://www.niashanks.com/long-goals/,578,"February 9, 2016",Nia Shanks,,
A New Diet is Not the Solution to Problems Created by a Previous Diet,http://www.niashanks.com/diet-solution/,659,"December 22, 2015",Nia Shanks,,
10 Life Changing Mottoes Women Should Embrace,http://www.niashanks.com/life-changing-mottoes/,818,"December 17, 2015",Nia Shanks,,
"Build a Better Body Image, with Erin Brown on The Nia Shanks Show",http://www.niashanks.com/body-image-erin-brown/,297,"December 3, 2015",Nia Shanks,,
3 Kitchen Tools That Save Time and Money That I Wouldn't Want to Live Without,http://www.niashanks.com/kitchen-tools-save-time-money/,729,"November 30, 2015",Nia Shanks,,
You Don't Have Enough Self Compassion,http://www.niashanks.com/compassion-2/,736,"December 7, 2015",Nia Shanks,,
"Strong Woman Series, with Molly Galbraith",http://www.niashanks.com/strong-woman-series-molly-galbraith/,411,"December 10, 2015",Nia Shanks,,
Here's What We Can Learn from the Teacher Who Lost Weight on the McDonald's Diet,http://www.niashanks.com/mcdonalds-diet/,292,"December 15, 2015",Nia Shanks,,
Health and Fitness has become a Religion. And That's a Terrible Thing.,http://www.niashanks.com/health-fitness-religion/,822,"December 29, 2015",Nia Shanks,,
"A Teacher Lost 56 Pounds Eating Nothing but McDonald's, and People are Pissed",http://www.niashanks.com/teacher-lost-weight-eating-mcdonalds/,1673,"October 16, 2015",Nia Shanks,,
Apple Pie and Pumpkin Pie Oatmeal Recipes,http://www.niashanks.com/apple-pumpkin-pie-oatmeal/,749,"October 28, 2015",Nia Shanks,,
Introducing The Nia Shanks Show! Dr. Krista Scott-Dixon Drops Knowledge Bombs in Episode 2.,http://www.niashanks.com/introducing-nia-shanks-show-krista-scott-dixon/,824,"November 4, 2015",Nia Shanks,,
Still Playing It Safe? Why You Should Get Out of Your Comfort Zone,http://www.niashanks.com/comfort-zone/,860,"November 9, 2015",Nia Shanks,,
The Diet That Has No Name (and Why It May be the Best Thing Ever),http://www.niashanks.com/the-diet-that-has-no-name/,1222,"November 16, 2015",Nia Shanks,,
"Destroying ""The Box"", Facing Fear, and More on The Nia Shanks Show",http://www.niashanks.com/the-box-nia-shanks-show/,375,"November 11, 2015",Nia Shanks,,
The Nia Shanks Show Episode 4: STRONG Woman Series,http://www.niashanks.com/nia-shanks-show-episode-4/,386,"November 19, 2015",Nia Shanks,,
Exercise is Not Punishment for Eating and You Do Not Have to Earn Your Food.,http://www.niashanks.com/exercise-is-not-punishment/,950,"November 23, 2015",Nia Shanks,,
"If How You Eat and Work Out Doesn't Make You Feel Good About Yourself, Read This Now",http://www.niashanks.com/feel-good-about-yourself/,634,"August 25, 2015",Nia Shanks,,
"Enough With The ""Real Women"" Nonsense",http://www.niashanks.com/real-women-nonsense/,787,"September 3, 2015",Nia Shanks,,
7 Ways Strength Training Makes Your Life More Awesome,http://www.niashanks.com/strength-training-awesome-life/,976,"August 19, 2015",Nia Shanks,,
How to Stop Letting Fear Hold You Back (Even if You Don't Realize It Is),http://www.niashanks.com/stop-letting-fear-hold-you-back/,932,"September 15, 2015",Nia Shanks,,
How to Build a Home Gym According to Your Budget and Available Space,http://www.niashanks.com/build-home-gym-budget/,1266,"September 22, 2015",Nia Shanks,,
Simple 4 Ingredient Apple Sundae,http://www.niashanks.com/apple-sundae/,512,"September 29, 2015",Nia Shanks,,
Life Has Oh Shit! Moments. Here's What to do with Them.,http://www.niashanks.com/oh-shit-moments/,965,"October 6, 2015",Nia Shanks,,
Doing Too Much Causes Stress and Costs You Long Lasting Results,http://www.niashanks.com/doing-too-much/,856,"October 14, 2015",Nia Shanks,,
Why Most 30 Day Challenges Suck (and 3 Challenges That Actually Work),http://www.niashanks.com/30-day-challenges/,1450,"June 24, 2015",Nia Shanks,,
Fit and Fat Shaming - This Needs to Die. Now.,http://www.niashanks.com/fit-fat-shaming/,622,"June 19, 2015",Nia Shanks,,
7 Reasons Why You Should Not do a Sugar Detox,http://www.niashanks.com/sugar-detox/,1772,"July 2, 2015",Nia Shanks,,
5 Principles to Stay Fit on Vacation (or Traveling),http://www.niashanks.com/stay-fit-on-vacation-traveling/,1238,"July 21, 2015",Nia Shanks,,
Changing Women's Health and Fitness. Join the Revolution!,http://www.niashanks.com/changing-womens-health-fitness/,1006,"July 9, 2015",Nia Shanks,,
Life is too Short to Diet,http://www.niashanks.com/life-is-too-short-to-diet/,651,"July 30, 2015",Nia Shanks,,
"The Problem with ""Listen to Your Body"" and What to do About It",http://www.niashanks.com/listen-to-your-body/,703,"August 4, 2015",Nia Shanks,,
"The ""But I Only Have 20 Minutes"" Workout Solution",http://www.niashanks.com/20-minute-workout/,1023,"August 12, 2015",Nia Shanks,,
A Tasty Smoothie That Actually Keeps You Full,http://www.niashanks.com/smoothie-keeps-you-full/,913,"May 28, 2015",Nia Shanks,,
Disordered and Binge Eating - Who is at Risk and How to Break Free,http://www.niashanks.com/disordered-binge-eating/,352,"June 3, 2015",Nia Shanks,,
10 Instances When You Should do the Opposite of What's Popular,http://www.niashanks.com/opposite-popular/,1267,"June 10, 2015",Nia Shanks,,
6 Techniques to Add Variety to Bodyweight Exercises,http://www.niashanks.com/variety-bodyweight-exercises/,1413,"April 23, 2015",Nia Shanks,,
NEW Bodyweight Exercise and Workout Tutorial,http://www.niashanks.com/new-bodyweight-exercise-tutorial/,81,"April 28, 2015",Nia Shanks,,
Damage Control - What to do When You Over Indulge,http://www.niashanks.com/damage-control-when-you-over-indulge/,1016,"May 5, 2015",Nia Shanks,,
How to Stick to Your Diet,http://www.niashanks.com/how-to-stick-to-your-diet/,896,"May 13, 2015",Nia Shanks,,
4 Reasons Women Should Train for Strength,http://www.niashanks.com/women-should-train-strength/,881,"May 22, 2015",Nia Shanks,,
7 of the Best Bodyweight Exercises (and Easier to More Difficult Variations) You Should be Doing,http://www.niashanks.com/best-bodyweight-exercises/,1980,"April 21, 2015",Nia Shanks,,
"3 Ingredient Crock Pot Shredded Chicken (Cheap, Fast to Prepare, and TASTY)",http://www.niashanks.com/3-ingredient-shredded-chicken/,545,"March 26, 2015",Nia Shanks,,
Things Don't Always Go as Planned - This is What You Do,http://www.niashanks.com/dont-go-as-planned/,713,"March 4, 2015",Nia Shanks,,
Is Motivational Stuff Stupid?,http://www.niashanks.com/motivation/,871,"April 2, 2015",Nia Shanks,,
How to Perform Assisted Handstand Push-ups,http://www.niashanks.com/assisted-handstand-pushups/,631,"April 13, 2015",Nia Shanks,,
12 Ways to Alter Exercises for More Workout Variety,http://www.niashanks.com/alter-exercises/,2935,"February 24, 2015",Nia Shanks,,
1 BIG Reason Women Should Lift Heavy Things,http://www.niashanks.com/big-reason-women-lift-heavy/,659,"March 19, 2015",Nia Shanks,,
"13 Ways Women Can be MORE, Not Less",http://www.niashanks.com/be-more-not-less/,1785,"March 12, 2015",Nia Shanks,,
What Would Happen if You Focused on THIS and Not That?,http://www.niashanks.com/focus/,533,"December 10, 2014",Nia Shanks,,
5 Reasons to Avoid Detoxes & Cleanses (and What You Should Do Instead),http://www.niashanks.com/avoid-detoxes-cleanses/,1443,"December 30, 2014",Nia Shanks,,
Why I No Longer Set Goals and Why You (Perhaps) Shouldn't Either,http://www.niashanks.com/no-more-goals/,984,"January 6, 2015",Nia Shanks,,
The Women's Beginner Strength Training Guide,http://www.niashanks.com/womens-beginner-strength-training-guide/,1899,"February 12, 2015",Nia Shanks,,
Fast & Furious Bodyweight Ladder Workout,http://www.niashanks.com/bodyweight-ladder-workout/,1002,"January 13, 2015",Nia Shanks,,
Triple-Exercise Total Body Workouts,http://www.niashanks.com/triple-exercise-workout/,965,"January 27, 2015",Nia Shanks,,
You're Not Your Diet. You're Not Your Body Fat Percentage.,http://www.niashanks.com/not-your-diet/,852,"February 3, 2015",Nia Shanks,,
"These are the Bare Essentials, and They Produce Extraordinary Results",http://www.niashanks.com/bare-essentials/,897,"February 16, 2015",Nia Shanks,,
4 Ingredient Oatmeal French Toast-Cake,http://www.niashanks.com/oatmeal-cake/,1088,"October 15, 2014",Nia Shanks,,
Is Your Fitness Regimen Making You Awesome?,http://www.niashanks.com/fitness-regimen-awesome/,898,"October 22, 2014",Nia Shanks,,
One (Not Weird or Secret) Tip for Fat Loss,http://www.niashanks.com/fat-loss-tip/,755,"November 6, 2014",Nia Shanks,,
How to Correctly Perform Band Assisted Pull-ups AND An Advanced Variation,http://www.niashanks.com/band-assisted-pullup/,1543,"October 28, 2014",Nia Shanks,,
4 Reasons to Simplify Your Nutrition & Workout Habits,http://www.niashanks.com/simplify-nutrition-workout-habits/,928,"November 20, 2014",Nia Shanks,,
Stop Binge Eating - 33 Ways to Break Free,http://www.niashanks.com/stop-binge-eating/,1821,"November 11, 2014",Nia Shanks,,
Why You Shouldn't Have (Fat Loss) Goals,http://www.niashanks.com/dont-have-fat-loss-goals/,1403,"November 26, 2014",Nia Shanks,,
The NEW Definition of Fitness (or Just Another Stupid Fitness Article But You Should Read It Anyway),http://www.niashanks.com/redefine-fitness/,1542,"December 4, 2014",Nia Shanks,,
How to Respond When Life Kicks You in the Ovaries,http://www.niashanks.com/life-lessons/,1327,"August 19, 2014",Nia Shanks,,
Lift Like a Girl TV: Fit Girl Fashion Problems (and Solutions!). How to Wear Your Confidence.,http://www.niashanks.com/fit-girl-fashion/,786,"August 21, 2014",Nia Shanks,,
The 3 Step Process to Achieve ALL of Your Fitness Goals,http://www.niashanks.com/achieve-goals/,1155,"August 26, 2014",Nia Shanks,,
"What It Means To Be a ""Real"" Woman",http://www.niashanks.com/real-woman/,594,"September 3, 2014",Nia Shanks,,
One Powerful Tip for Better Workouts and More Results,http://www.niashanks.com/one-tip-better-workout/,476,"September 10, 2014",Nia Shanks,,
10 Week Minimalist Strength Training Program,http://www.niashanks.com/10-week-minimalist-program/,421,"September 16, 2014",Nia Shanks,,
High Rep Squat Workouts and Variations,http://www.niashanks.com/high-rep-squats/,1622,"September 25, 2014",Nia Shanks,,
This May be More Important Than How You Eat or Work Out,http://www.niashanks.com/mindfulness-2/,931,"October 2, 2014",Nia Shanks,,
"When ""Health and Fitness"" Isn't Really Healthy, and What to Do About It",http://www.niashanks.com/health-fitness/,1037,"July 2, 2014",Nia Shanks,,
"Lift Like a Girl TV - Molly Galbraith of Girls Gone Strong: Body Image, Motivation, and Developing Long-Term Habits",http://www.niashanks.com/molly-galbraith/,724,"June 26, 2014",Nia Shanks,,
You Don't Need a Gym to Get Fit - Try This Playground Workout,http://www.niashanks.com/playground-workout/,1073,"July 11, 2014",Nia Shanks,,
"For Transforming Your Body or Changing Your Life, Perspective is Your Greatest Tool",http://www.niashanks.com/perspective/,1403,"July 17, 2014",Nia Shanks,,
Total Body Workouts You Can Perform with a Swing Set (or Suspension Trainer),http://www.niashanks.com/swing-set-workout/,1092,"July 29, 2014",Nia Shanks,,
The Ultimate Guide on How to Not Care About What Other People Think of You and Live the Life You Want,http://www.niashanks.com/guide-not-care-what-people-think/,2301,"August 13, 2014",Nia Shanks,,
"Operation Play More, Work Out Less (Exercise is NOT Mandatory)",http://www.niashanks.com/play-2/,1594,"August 5, 2014",Nia Shanks,,
"Lift Like a Girl TV - Meg ""Fit Bitch"" Brown",http://www.niashanks.com/fit-bitch/,437,"May 27, 2014",Nia Shanks,,
Two Day Per Week Strength Training Program,http://www.niashanks.com/two-day-strength-program/,936,"May 30, 2014",Nia Shanks,,
Lift Like a Girl TV - Marianne Kane,http://www.niashanks.com/marianne-kane/,455,"June 3, 2014",Nia Shanks,,
"NEW Lift Like a Girl Tutorial - Workouts, Exercise Demos, and Techniques in One Convenient Location",http://www.niashanks.com/new-tutorial-workouts/,174,"June 6, 2014",Nia Shanks,,
4 Advantages of Dumbbell Exercises and Why You Should Use Them (And 3 Disadvantages),http://www.niashanks.com/dumbbell-exercises/,1527,"June 9, 2014",Nia Shanks,,
"Lift Like a Girl TV - Kellie Davis Discusses Strength Training and Nutrition Before, During, and After Pregnancy",http://www.niashanks.com/strength-train-pregnancy/,428,"June 12, 2014",Nia Shanks,,
The Unspoken Darkside to Training for Performance and Focusing on What Your Body Can Do,http://www.niashanks.com/darkside-performance/,1456,"June 17, 2014",Nia Shanks,,
"A Great, Underused, Single Leg Exercise You Should be Performing",http://www.niashanks.com/lateral-lunge/,799,"June 23, 2014",Nia Shanks,,
The Nutrition Survival Guide (Don't Become a Diet Zombie),http://www.niashanks.com/nutrition-survival-guide/,913,"May 13, 2014",Nia Shanks,,
Lift Like a Girl TV with Jill Coleman: Give Your Mind a Makeover (This is the Ultimate Game Changer),http://www.niashanks.com/mindset/,647,"July 22, 2014",Nia Shanks,,
"Health and Fitness Gone Bad - When It Degrades Women, And What We Can Do About It",http://www.niashanks.com/fitness-degrade-women/,474,"April 15, 2014",Nia Shanks,,
4 Delicious Slow Cooker Recipes and 3 Reasons Why It's the Best Kitchen Tool Ever,http://www.niashanks.com/slow-cooker-recipes/,1021,"May 16, 2014",Nia Shanks,,
Does Your Fitness Regimen Pass The Test? Why You Need to be able to Answer Yes! to This One Question,http://www.niashanks.com/fitness-test/,334,"April 18, 2014",Nia Shanks,,
"7 Simple Steps to Lose Fat, and Keep It Off",http://www.niashanks.com/lose-fat-easily/,1455,"April 23, 2014",Nia Shanks,,
"The ""I Don't Want to Work Out But I Know I Need to"" Workout Solution",http://www.niashanks.com/dont-want-to-work-out/,1397,"April 30, 2014",Nia Shanks,,
You're Stronger Than You Think You Are,http://www.niashanks.com/stronger-than-you-think/,584,"March 31, 2014",Nia Shanks,,
5 Reasons Women Should Strength Train That are WAY Better than just Building a Great Looking Body,http://www.niashanks.com/strength-training-benefits/,1245,"May 6, 2014",Nia Shanks,,
Let Go: How to Get Rid of Anxiety Caused by Health and Fitness (And Why It Will Help Achieve Better Results),http://www.niashanks.com/let-go/,1287,"May 9, 2014",Nia Shanks,,
"Intuitive Strength Training: What It Is, Why It's Awesome, and How It Can Help You Achieve Better Results",http://www.niashanks.com/intuitive-strength-training-awesome/,737,"March 4, 2014",Nia Shanks,,
