title,link,word_count,date,author,comments_count,notes
Fat Burning Jump Rope Workout,http://www.niashanks.com/fat-burning-jump-rope-workout/,478,"August 31, 2009",Nia Shanks,,
How To Make Your Own Sand Bag,http://www.niashanks.com/how-to-make-your-own-sand-bag/,302,"August 24, 2009",Nia Shanks,,
10 Minute Time Crunch Workouts for Fat Loss,http://www.niashanks.com/10-minute-time-crunch-workouts-for-fat-loss/,354,"September 14, 2009",Nia Shanks,,
Don't Train for Fat Loss - Train for Strength,http://www.niashanks.com/dont-train-for-fat-losstrain-for-strength/,533,"May 26, 2009",Nia Shanks,,
Fat Burning Circuit,http://www.niashanks.com/fat-burning-circuit/,133,"May 30, 2009",Nia Shanks,,
Stop Training for Fat Loss,http://www.niashanks.com/stop-training-for-fat-loss/,433,"June 2, 2009",Nia Shanks,,
Should Women Train Like Men?,http://www.niashanks.com/should-women-train-like-men/,490,"June 19, 2009",Nia Shanks,,
Fasting for Weight Loss,http://www.niashanks.com/fasting-for-weight-loss/,917,"June 22, 2009",Nia Shanks,,
27 of the Best Weight Loss Exercises,http://www.niashanks.com/27-of-the-best-weight-loss-exercises/,1895,"June 24, 2009",Nia Shanks,,
Women Should Not be Afraid to Get Strong,http://www.niashanks.com/women-should-not-be-afraid-to-get-strong/,778,"June 25, 2009",Nia Shanks,,
Stop Trying to Reach an Ideal Weight,http://www.niashanks.com/stop-trying-to-reach-an-ideal-weight/,702,"June 29, 2009",Nia Shanks,,
